"author","datePosted","title","review","HTML","overall","parts","buildingExperience","playability","valueForMoney"
"Chemistry2101","2019-06-04T20:44:06.537Z","Is this really UCS?","<p>As suggested by the title of this review, I am dissatisfied by the characterisation of this set as Ultimate Collector Series,&nbsp;or rather, there are some features of this set that I don&#39;t feel fit in with what I at least have come to expect from the UCS line. My aim in this review is to explain why I hold such an opinion. On with the review.</p>

<p>Parts:</p>

<p>There are a fair number of technic pieces, and a lot of plates, but nothing really special or memorable. Obviously there are a lot of brown.</p>

<p>Minifigs:</p>

<p>The minifigs are seemingly one of the major selling points for this set, which is weird as a set branded as UCS, but nevertheless they are fantastic. The jawas reappear in LEGO form for the first time in a decade, Owen Lars is more detailed and more accurate than the previous version, and the large assortment of droids really make the Sandcrawler feel busy and bustling; the three astromechs are all wonderfully designed, C3PO is looking better than ever, and the Treadwell&nbsp;and Gonk&nbsp;droids are superb. Luke Skywalker however, simply is not. He should not have Anakin&#39;s&nbsp;lightsaber yet, and his face looks far too aged for the character at such an early point in the saga; it really doesn&#39;t look great. Still, I&#39;m sure anyone buying this set will probably already own a (or more likely, many)&nbsp;Tatooine-themed Luke, so won&#39;t be too bothered, as they will mostly be focused on all the other great minifigs.</p>

<p>The Model:</p>

<p>The model is highly detailed, and a massive improvement on its predecessor, with great usage of technic parts, lots of plates, and SNOT techniques to create a much better outcome than the brick built Sandcrawler we saw before. The inside is reasonably well detailed, with plenty of space for all the extra bits that come with the set; three crates, a small jawa craft, and attachments for both cranes. Once all of these extras are stuffed in, however, there isn&#39;t much space left, so don&#39;t expect to recreate any scenes inside the belly of the crawler. The front section has a bridge area for the jawa to pilot the Sandcrawler from, and this area actually works really well, with plenty of room. The front panel also unfolds in film accurate fashion to provide a ramp in and out. Overall the model looks superb, but to me the set feels quite small, especially for the piece count and price. My Sandcrawler is displayed in the same room as my other UCS sets and it&nbsp;definitely looks the smallest of all of these,&nbsp;even smaller UCS sets like Obi Wan&#39;s Jedi Starfighter. It&nbsp;is quite surprising that many of the&nbsp;other UCS sets&nbsp;feel bigger, when a lot of them&nbsp;have significantly fewer pieces. The Crawler does feel very dense though, so perhaps its&nbsp;size isn&#39;t too much of an issue, especially if you are going to display alongside other &quot;playsets&quot;. In all honesty I didn&#39;t really notice this until I got the UCS Imperial Shuttle,&nbsp;and that dwarfs even the Millennium&nbsp;Falcon.</p>

<p>Overall:</p>

<p>This is a fantastic design, and by far the best LEGO Sandcrawler to date, but it feels too much like a playset&nbsp;to me and doesn&#39;t really feel like it belongs among&nbsp;the other UCS sets.&nbsp;A superb set, and I would definitely recommend for anyone who wants a Sandcrawler as this is really the only decent version TLG has ever produced. If you are a UCS collector that wants big, detailed LEGO sets, I would still recommend it, but would say that you should not really expect a UCS. Notably it does not have a display plaque, a staple of UCS models. Additionally the number of minifgures is unusual and seems more indicative of a large playset, akin to the Death Star or Ewok Village, and certainly the numerous play features would back this up. Not only are there lots of them, but they do compromise the design somewhat in places, the most obvious example being the gear that protrudes through the roof that can be used to steer the crawler during play. It&#39;s a nice play feature but it compromises displayablility to an unacceptable level for a UCS set in my opinion, and further adds to my wondering whether or not TLG meant for this to be UCS in the sense that most UCS sets are. Who knows what they think most of the time, I certainly don&#39;t. What I do know is that this is a fantastic playset, but only a mediocre display set, so in terms of whether you should buy it, it really depends what you&#39;re looking for in this set. If you&#39;re only into big, detailed display models, I&#39;d recommend most other UCS sets first; if you want a set with play value, or like displaying all your LEGO Star Wars sets, you won&#39;t be disappointed.</p>
",TRUE,4,5,5,5,4
"scalawag","2020-06-14T07:15:13.5Z","Awesome Sandcrawler","<p>This is a really awesome set.</p>

<p>The build is great with a lot of interesting techniques used in construction and some really nice engineering which makes this a very solid build when completed.</p>

<p>The minifig line up is great too with some nice exclusive figures and some brick built droids.</p>

<p>For a UCS set this has a lot of play features (yes it is a UCS set. &nbsp;Lego decides what is in the UCS range and this says UCS on the box!). &nbsp;</p>

<p>2 Cranes, steering, drawbridge style front ramp, storage crates and boxes, storage compartments, control deck, moveable/removable panels and a lot more besides. &nbsp;This is something you could play with for hours and still find new things to do.</p>

<p>I totally love this set and would recommend it to anyone. &nbsp;The only downside to this set is the price now it has been retired but to be fare these can be had for a reasonable price and are not crazy over expensive like some retired sets can be.</p>

<p>If you like how it looks then buy one if you can. &nbsp;You won&#39;t regret owning this set.</p>
",TRUE,5,5,5,5,4
"Vikn","2021-02-05T03:48:47.457Z","The ""set that got away"" as a child, improved in near every way","<p>When I was a kid I pined for the original Sandcrawler set but never was able to get it. It embodied one of my favorite Star Wars Aesthetics, the grimy, industrial SCIFI vibe that much of Tattooine and especially the Jawas held. For me, the only comparable SW aesthetic were&nbsp;the bounty hunter/Hutt/Criminal areas, locations and scenes.</p>

<p>I got back into Lego for the first time as an adult in early 2019, right before my 26th birthday. That lasted until Christmas of that year. I had used up most of my display space and so I somewhat jokingly told my wife that I would stop buying Lego if I could cap off my hobby with the perfect set, in no way expecting her to get the very expensive, retired Sandcrawler She had no real issue with me getting Lego sets, as she is the same with&nbsp;fashion, specifically buying too much Lululemon, but we hyperbolically tease each other for money wasting hobbies.</p>

<p>Yet to my disbelief, she somehow got the vastly improved version of the set I&#39;d wanted as a kid. It was the largest set I&#39;d ever gotten at the time, still is near the top. So, mostly due to display space limitations, my interest turned to other hobbies for all of 2020. I recently got back into Lego and just started using Brickset.&nbsp;</p>

<p>If my reviews seem largely too positive, it is only because I am beginning the process of reviewing my older sets with those that really stand out to me, my big favorites.</p>

<p>I&#39;d imagine most or even all adults who were childhood fans of Lego had at least one set that represented&nbsp;<em>the one that got away. I </em>would also imagine that the Sandcrawler was that set for many. If you have the chance to get this set at a &quot;reasonable&quot; price, I wouldn&#39;t hesitate for a moment.</p>

<p>It is one of the more involved builds. While I can&#39;t imagine there are ant &quot;difficult&quot; sets for an adult to build (Colored step by step instructions basically make them all pretty easy) some sets involve more complex mechanisms and techniques. This is one of the better examples of such a set. I normally strongly dislike play features, being a 27yo man, they remain completely unused but still increase prices, but the features in the UCS Sandcrawler feel more like Lego&#39;s attempt to approximate a machine and the complexity of the Sandcrawler&#39;s fictional mechanics. They add to the experience, both build and display.&nbsp;</p>

<p>The build is as almost good as it gets, even with the tedium of sorting through small brown pieces. The minifigures are great, I thought at least. I LOVE when a set includess a variation of buildable star wars droids. They&#39;re tiny and simple, but getting the chance to see an improved manifestation of the interesting droids that only briefly appear is just fun.</p>

<p>There is really not much to complain about with this set. I got VERY lucky with UCS sets, the only ones I have being the Slave I and this...having two of the best, I am not rushing to get any of the retired UCS sets that I am far less interested in. They&#39;ll seem worse relative to the two I have.&nbsp;&nbsp;</p>

<p>This is a must-have for SW fans, that&#39;s basically all that needs to be said. Since I got it, I have seen the price rise steadily and so It&#39;s unfortunate that many won&#39;t be able to afford it...but IF you can and you love Lego Star Wars, I can&#39;t recommend this set highly enough.</p>
",TRUE,5,5,5,5,5
"RundownPear","2022-04-27T18:34:36.07Z","Decent UCS Set, an Amazing Lego Set","<p>This is a set that you really have to look at through the eyes of the 2014 Lego landscape. A time before the Assault on Hoth controversy and before the 18+ rebranding of all adult-focused Lego sets. Retailing at $299 (~$350 in 2022 USD) the Sandcrawler was a great addition to the UCS and larger Lego lineup.&nbsp;</p>

<p>The build is simply fantastic. So many interesting techniques are used to achieve a steady frame and accurate angels. From the slight angle of the cockpit&#39;s roof, to the excellently done treads, this set earns its place as a UCS display model despite being a focused playset. It is stable and strong and the detailing is top tier. They were able to achieve a strong connection of the front ramp to the main body when closed, and it comes together with the main body panels perfectly. The size is large and the build feels heavy, despite not being minifigure scale it still towers over almost every other SW vehicle.</p>

<p>The interior contains a well-developed crane system with several attachments to move the included cargo boxes around and load them onto the included speeder. Although I wish the droid shop was included I&#39;m still satisfied with what they came up with. The biggest con is the side crane can not be deployed to the exterior without removing a majority of the vehicle&#39;s roof.&nbsp;</p>

<p>The minifigures fit perfectly with this set. You get Luke Skywalker, Owen Lars, R2 and C-3PO, two pairs of Jawas, two astromechs, and three brick built droids (including a Gonk). The figures are nice and complement the set well and can be used to set up a nice display scene recreating Owen Lars&#39; purchase of R2 and C-3PO.&nbsp;</p>

<p>Overall the biggest con of this set is the lack of a plaque, it would have complemented it very nicely like how they did it with the later UCS Falcon and AT-AT. The price back when this was released was also quite high, it was equivalent to $350 today which is the same as current MBS sets. I think $50 less would be more appropriate. This is a great set and I consider it a must-have if you can find it for a reasonable price.&nbsp;</p>
",TRUE,5,5,5,4,4
