"author","datePosted","title","review","HTML","overall","parts","buildingExperience","playability","valueForMoney"
"dawgnut01","2016-09-25T00:27:49.89Z","Finally something different for Technic","<p abp=""692"">Overall opinion</p>

<p abp=""692"">I like big sets and this is the largest to date for Technic. And it is huge! I couldn&#39;t help but laugh upon opening the box and pulling out bag after bag of pieces. 33 in all, not including the small bags inside the bigger. The book is great.</p>

<p abp=""692"">The finished model is huge, heavy, and impressive. Looks great. The functions on the other hand are a big swing and a miss for me. I like the idea of all of the functions but in practice they just don&#39;t work. I&#39;m an experienced Technic AFOL and I&#39;m very careful with gears and friction points but it didn&#39;t seem to matter. The main function - the shovel digger and conveyor belts - jam and stop. Pretty sure I didn&#39;t get a full revolution of the belt before it seized up. The rotation and movement tracks didn&#39;t work at all. I removed the main conveyor belt and removed all of the 5L beams. While out, the rotation function worked and the movement tracks tried to move, very slowly. I don&#39;t really mind that since these machines move slowly in full size. I put the main conveyor back in and tried again. It now works but requires a bit of coaxing every 5-10 seconds. The movement tracks and rotation stopped again.</p>

<p abp=""692"">So in the end, functions are useless. Playability, which should be great, is a big letdown for my 6yo son and myself. Still a great build though and that&#39;s what I mainly look for in a Lego set.</p>

<p abp=""709"">&nbsp;</p>
",TRUE,4,5,5,2,4
"ian404","2016-11-22T14:54:23.633Z","Greatest Technic set ever!","<p>Other reviewers have already done some great and detailed reviews, but just to add a few additional points:</p>

<p>1. The build is absolutely amazing!! &nbsp;The vast majority of Technic sets are cars or trucks, there are a few aircraft and the odd motorcycle. &nbsp;This model rather builds like a building, with a solid structural frame, and lots of unusual and interesting techniques used. &nbsp;It&#39;s a tough but very rewarding build.</p>

<p>2. The parts selection is awesome! &nbsp;Not only is this set huge, but it has heaps of big liftarms (85 of the 15-length ones), Technic frames (60+), around 150 gears and a number of panels. &nbsp;The included power functions and wheels and steering in the small truck add extra possibilities for your own creations. &nbsp;In other words, if you only ever bought one Technic set, you wouldn&#39;t go wrong with this one.</p>

<p>3. Regarding the difficulties some have reported with the functioning of the set, my experience has been the opposite - I&#39;ve found the model to be powerful and robust, able to dig up heaps of bricks while bumping up against my hands and the ground, without a single click from the friction gears. &nbsp;What I did find was that, even more than usual for a big Technic set, you need to keep checking back to ensure that gears and axles can spin freely, and wiggle them loose if they don&#39;t. &nbsp;Some of this construction has a number of gears sandwiched between liftarms, and a lot of friction can result if you don&#39;t loosen them constantly while building.</p>

<p>Finally, this set passed the 8-year-old test. &nbsp;My daughter absolutely loves how it works, more than any other set. &nbsp;It&#39;s huge, looks great and works in a really fun way. &nbsp;I&#39;d recommend it highly.</p>
",TRUE,5,5,5,4,5
"pinz","2018-03-11T16:47:33.573Z","Massive that’s the word to use for this set","<p>3996 Parts, plus some spares, so it is a huge amount of parts, most of them straight forward and no fancy colors, even if there are a lot. You have lots of liftarms, pins, panels and gears. Also chains you have lots and lots.&nbsp;</p>

<p>&nbsp;</p>

<p>In total you build in 8 sections, that is quite good, because so have not too many parts to sift through.</p>

<p>The only thing, in my opinion, is, that this whole massive machine is powerd by a lonely XL-Motor. So you have a long transmission to everywhere you need to set something in motion. The bucket wheel it self is powered by one of the conveyer belts.</p>

<p>The functions are plenty, 2 conveyer belts, the bucket wheel, one belt can be turned by 180 degrees, it is moving itself on chains, but only straight. You have a extra vehicle that takes the load. Also a lot of details are there.</p>

<p>&nbsp;</p>

<p>The downside: to less power, Lego&nbsp;should have put at least 2 motors in, and an RC. The bucket wheel gets easy blocked, because something clogs one of the conveyers, so you have to look around and remove the blockade. So the conveyer belts should have been a bit more protected against spilling over.&nbsp;</p>

<p>The instruction has also one or two errors where something was missed in a step. So I looked o n the pages before, just double check myself.</p>

<p>&nbsp;</p>

<p>But in general it is a good value set, you get tons of parts, you can play nicely with it - just keep a eye on the conveyers - and you have some powerfunctions. My kids are loving it, just because it is sooooo big. Hard to find a place for it ;)</p>

<p>In my opinion this set should have been the anniversary model from last year, just with at least one or two motors more. Instead we got the infuriating&nbsp;42070.</p>
",TRUE,5,5,5,4,4
"frost1989","2018-02-08T07:38:42.367Z","The Infamous BWE","<p>The whopping massive count of pieces which sets me and my friend&#39;s jaws apart when we open this giant box of 42055.</p>

<p>I had this built alongside with my friends, taking turns and took us almost 9 hours (with breaks in between) to complete this set.</p>

<p>Nonetheless, while we were taking our sweet and bitter time (slightest mistakes and you are in trouble for redo) for this set, we does achieve great satisfaction far more than we expected after the set was complete, its size is monstrous and intimidate, and of course, it works wonder.</p>

<p>Appearance<br />
Although this LEGO bucket wheel excavator does not resembles any of the real life bwe, the design is still impressive, some might say this set looks rather crude, but you gotta forgive the ugly chassis it presents, is functionality before looks, and the dark blue and yellow color does blend quite well together in overall looks.</p>

<p>This set is sturdy and solid built, capable to withstand rough handling, easy to carry despite of its size, and not to mention how many attention you will get if you display this on your working desk.</p>

<p>Functions<br />
Having only ONE motor to move this giant piece of lego (weighted around 3kg) is a huge disappointment for this set, its moves and works like a snail, and I do understand that this was suppose to move slow equal for its real life counterpart, but seriously it could work just a little faster, eg. the superstructure rotation.</p>

<p>I suggest replace two of the clutch gears attached on the motor (near the battery box) with gear wheel Z24 so that it can moves a little faster on a pleasant speed, although you need to switch on the function first before you turn on the power to prevent the motor from being stalled. It is a nice try and it does really sped up all of the motorized functions to an impressive speed than using the clutch gear.</p>

<p>Lets not forget about the dump truck that comes with it, I personally do love this small white dump truck because its steer so smoothly without any backlash and does its job super well done with simple operation.</p>

<p>The building of this set is pretty straight forward, friendly enough for beginner whom just step into technic series, and the huge amount of parts is definitely worth the bucks.</p>
",TRUE,5,5,4,5,5
"Tom09","2020-06-14T11:49:30.893Z","Great Build but Difficult to Disassemble.","<p>I chose to buy&nbsp;this set because I&nbsp;wanted a challenge. When building this set, you have to get through a lot of challenges just to put it&nbsp;together. I liked the fact that even though this set was huge, it had an&nbsp;alternative model which was&nbsp;surprising seeing how big this set actually is. I thought the bucket wheel was a great detail since making something like it would normally end up looking like a mess, but the LEGO group pulled it together and made it look and work perfectly. But when it comes to the disassembly, this set is a pain. It&#39;s all fine until you reach the base.&nbsp;This will be the most difficult part of the disassembly. Unless&nbsp;you have small fingers, you will not be able to pull out the pegs and axles inside the base, leaving you with a mess.</p>
",TRUE,5,5,4,4,4
