"author","datePosted","title","review","HTML","overall","parts","buildingExperience","playability","valueForMoney"
"Rock_Raider","2009-07-05T04:58:00.467Z","Air boat","This was my first studios set.
If you have lego 1362, 1360, 1361 and 1363, you can make combination modle, the big helicopter.

Pros                                   Cons

Minifig with axle face.           None
Comic",FALSE,2,0,0,0,0
"KLOKRIECHER","2011-07-28T10:11:35.453Z","LEGO Studios - Air Boat Review","This is one of the smallest LEGO Studios sets I have. It has almost no play features. The only feature you get is that the propeller on the back sviwels full 360°. The built of this set is very easy and it's a very sturdy set. We also get a comic book with this set and you won't have to worry about stickers as well. This set comes with the LEGO Rock Raiders minifigure Axel. This character is in many LEGO Rock Raiders sets and for some reason we get him in this model, too. This time he has a dark gray helmet with a black visor. I think if you plan to get some LEGO Studios sets I would recommend you to buy the bigger ones first before you get this little set.<br><br>All
in all this set is a good set and I would recommend you to get
this. You can find this set on eBay, BrickLink and Amazon for sure.
Here is the link where you can check out the full gallery I made for this set
on my website: <a href=""http://www.klokriecher.de/home.php?id=202040070000"">http://www.klokriecher.de<br></a> <br><br><span style=""font-weight: bold;"">Videos I made of this set:</span><br><a href=""http://www.youtube.com/user/KLOKRIECHER?feature=mhee#p/search/1/7NRSbewbmJM""><br>Stopmotion</a><br><a href=""http://www.youtube.com/user/KLOKRIECHER?feature=mhee#p/search/0/wxMPSenPqD0"">Review   </a><br>",TRUE,2,2,3,1,2
