"author","datePosted","title","review","HTML","overall","parts","buildingExperience","playability","valueForMoney"
"ninbricks","2020-09-01T15:52:53.35Z","Hamburg 1st of September 2k20: a Razor Crest Class-Shuttle hits the shelves","<p align=""LEFT"" style=""margin-bottom: 0.35cm; font-weight: normal; line-height: 115%""><font color=""#000000""><font face=""Calibri""><font size=""2"" style=""font-size: 11pt""><span style=""background: transparent"">This is a short review of one of the most anticipated LEGO STAR WARS products of this unholy year 2k20. The Razor Crest Class-Shuttle, also known as The Mandalorian Bounty Hunter Transport.</span></font></font></font></p>

<p align=""LEFT"" style=""margin-bottom: 0.35cm; font-weight: normal; line-height: 115%""><font color=""#000000""><font face=""Calibri""><font size=""2"" style=""font-size: 11pt""><span style=""background: transparent"">I was the 17<sup>th</sup> in a row before the shop, and the last one of the first wave that was allowed to enter. And I can tell you folks, this set was running quick from the shelves. By the way, here in Hamburg it is named &ldquo;75292 The Razor Crest&rdquo;.</span></font></font></font></p>

<p align=""LEFT"" style=""margin-bottom: 0.35cm; font-weight: normal; line-height: 115%""><font color=""#000000""><font face=""Calibri""><font size=""2"" style=""font-size: 11pt""><span style=""background: transparent"">The building process was quite enjoyable and the &ldquo;beloved&rdquo; stickers were less than expected and easy to apply. So no drama. In the end you get quite a mighty result with some little flaws that can easily be eradicated. </span></font></font></font></p>

<p align=""LEFT"" style=""margin-bottom: 0.35cm; font-weight: normal; line-height: 115%""><font color=""#000000""><font face=""Calibri""><font size=""2"" style=""font-size: 11pt""><span style=""background: transparent"">Here are my points of criticism: a) the underside of the tail needs more substance and looks kinda flimsy from certain angles. Easily done with a few spare parts. b) if you detach the escape&ndash;pod you can directly look into the cargo&ndash;bay. Some plates can help fix the issue. c) there are some gaps on the front sides, where you can see gray technic beams. With some tiled plates you can cover the 1x8 long space and make the look more smooth. d) the landing gear is not retractable. But this is more an afol-issue, isn&#39;t it? At least we have landing gear...</span></font></font></font></p>

<p align=""LEFT"" style=""margin-bottom: 0.35cm; font-weight: normal; line-height: 115%""><font color=""#000000""><font face=""Calibri""><font size=""2"" style=""font-size: 11pt""><span style=""background: transparent"">Some praise goes to: a) the huge cargo bay with ammunition storage and relaxing area. You can easily put all the figures from 75254 AT-ST Raider and 75267 Mandalorian Battle Pack in there and still have some space for a cargo crate. For a toy this is a great playfeature in my eyes and the possibility to reach all that inside space is a clever part of the model. And still it is robust like a toy should be. b) the cockpit and weapon storage. The cockpit offers space for two minifigures and can be pimped with a few console-tiles. The weapon storage can hold up to 4 guns inside. And we get a lot of weapons in this set! c) the overall design. Of course, things can be done better. But this model offers a good deal between &ldquo;toy with maximum inside-space and playfeatures&rdquo; and &ldquo;display-model&rdquo;. Like &ldquo;the Mandalorian&rdquo;, who was a good deal to the whole &ldquo;STAR WARS Thing&rdquo;, this version is a good deal for the whole &ldquo;LEGO STAR WARS Universe&rdquo;. </span></font></font></font></p>

<p align=""LEFT"" style=""margin-bottom: 0.35cm; font-weight: normal; line-height: 115%""><font color=""#000000""><font face=""Calibri""><font size=""2"" style=""font-size: 11pt""><span style=""background: transparent"">BUT, we haven&#39;t lost a word on the figures yet. And as a dear friend from Georgia used to say &ldquo;and this is how the cookie crumbles&rdquo;:</span></font></font></font></p>

<p align=""LEFT"" style=""margin-bottom: 0.35cm; font-weight: normal; line-height: 115%""><font color=""#000000""><font face=""Calibri""><font size=""2"" style=""font-size: 11pt""><span style=""background: transparent"">We do get &ldquo;the child&rdquo;. O.K. This lil dude was long awaited, and they captured him quite well. BUT getting the same version of armour for our main character as in the set 75254 is lousy inaccurate, because we get a Scout Trooper also in this set. And all who know the series will know it&#39;s a timeline error. Just like the problem with Obi Wan in the new Grievous fighter-set. Besides that, it&#39;s nice to get another Scout Trooper. And I really love the more accurate version of the scout helmet. The IG 11 is a nice figure, but totally the same as the IG 88 from Bounty Hunter Speeder Bike Battle Pack. So no big deal. Last but not least, Greef Karga. He looks quite good, but Lego really should have given him printed legs. He is wearing a cape over his right shoulder that should go deeper than to the waist. So he looks a little odd. But his double sided head looks marvelous and really matches the onscreen character. Anyway, he is one main character from season 1. And now we got him. And he is the only exclusive figure in this set. But unfortunately, there is no Kuill. Maybe we get him and a pair of new moulds for the Blurrg and the new armour in an upcoming set. He really would deserve it. </span></font></font></font></p>

<p align=""LEFT"" style=""margin-bottom: 0.35cm; font-weight: normal; line-height: 115%""><font color=""#000000""><font face=""Calibri""><font size=""2"" style=""font-size: 11pt""><span style=""background: transparent"">So my verdict:</span></font></font></font></p>

<p align=""LEFT"" style=""margin-bottom: 0.35cm; font-weight: normal; line-height: 115%""><font color=""#000000""><font face=""Calibri""><font size=""2"" style=""font-size: 11pt""><span style=""background: transparent"">I enjoyed the build and I really like the model. There are minor flaws, as stated above, but the overall model really feels like a step in the right direction. The minifigure selection is nice but could have been better. As a fan of the series I would recommend it to all fans and LEGO nerds alike. </span></font></font></font></p>
",TRUE,5,4,5,5,5
"alfred_the_buttler","2020-09-11T06:48:03.697Z","The Waiting is the Hardest Part","<p>Never had I had to wait so long to get a set than this set. No I didn&#39;t preorder it the first day it appeared on the Lego website, I was responsible and waited for May 4th to get the gift with purchase. Well here we are at the start of September and let me say the wait was worth it!</p>

<p>&nbsp;The Minifigures&nbsp;</p>

<p>So you get Mando obviously, but sadly he remains unchanged from the AT-ST set in his original armor. I find this acceptable as it goes along with the bounties frozen in carbon (as does Greef and even IG-11). Am I disappointed he isn&#39;t in beskar? Of course, they&#39;ll have no excuse not to highlight that in subsequent sets. He does have a solid black head, which I guess is also appropriate for this timeframe, I&#39;m sure this too shall change.&nbsp;It is a nice minifigure and if you don&#39;t already have it you will want it.&nbsp;</p>

<p>Greef Karga is another nice minifigure and given that he appears throughout more episodes than probably any other supporting character he is well worth getting. Nothing special about him, but it certainly does look like him.&nbsp;</p>

<p>IG-11 I think is an interesting choice without Kuiil, but he too deserves to be showcased. He isn&#39;t really any different from any other IG unit Lego made in the past, but then again, he is no different from any other IG unit in the galaxy.&nbsp;</p>

<p>You get a biker scout which to me seems very inappropriate for this set as by the time they appear, Mando has been wearing beskar for quite a while. He also is a standard biker scout. In my opinion he should have a shoulder bag like the Indiana Jones minifigures, it would at least give him something to punch! I also think that his inclusion would have justified a speeder bike as a mini-build, I guess I&#39;ll have to piece one together now. But really a standard storm trooper would have been more appropriate, or better yet the unnamed man who hires Mando to find a 50 year old bounty.</p>

<p>Of course you probably don&#39;t care about any of the above minifigures, because what you want is Baby Yoda! Well you don&#39;t get him until bag 2, and while I was tempted to open bag 2 first, I figured I waited half a year already, what&#39;s one more bag. So after finishing bag 1, I opened bag 2 and to my horror Baby Yoda was missing! For 5 minutes I was going crazy, trying not to scream since the kids were asleep, until I discovered there is a second smaller bag 2! That is where Baby Yoda was hiding. He is my first baby minifigure so I was a little surprised to learn that he is in no way posable and his hands are incapable of holding knobs, but he looks incredible nonetheless. His rubber head is the unique mold here and it was designed brilliantly, capturing all of his cuteness.&nbsp;I particularly like how Mando can carry him, although I must admit I would have loved to get a floating stroller, I guess I&#39;ll build my own, although I&#39;m not sure the right bricks exist to make it look good at the correct scale.&nbsp;&nbsp;</p>

<p>Parts</p>

<p>This is an expensive set, but it does have a lot of very large parts and not too many smaller parts. The part I was most impressed with, aside from the cockpit coverings, would have to be these I shaped technic bricks which I have never seen before (although I&#39;ve never bought a technic set). I would say it is a very nice selection although very gray. The stickers are actually quite welcome as they do greatly improve the overall look of the set.</p>

<p>&nbsp;The Build</p>

<p>I was pleasantly surprised with how the build turned out. The base of the ship is first and uses a little but not too much technic. But ultimately it is the way that the set uses technic that gives it its rigidity and openness. &nbsp;The build is incredibly varied as you build out the top and front of the ship, as well as the engines. The sides are panels, which is very common in many Star Wars vehicles and allow you to completely open it up. The only thing repetitive about the build is the engines as you build two of them and they feature eight flaps each going around the front of them. Overall the build took me 3 hours. While it wasn&#39;t anything revolutionary, it was varied and fun and very well done.&nbsp;</p>

<p>&nbsp;The Model&nbsp;</p>

<p>This is truly an amazing model, on par with the Millennium Falcon sets in terms of both size and playability. Clearly a lot of thought went into designing it and it shows. One feature of the interior is Mando&#39;s bed (and Baby Yoda&#39;s hiding place) which is nice to have. There is no door to the room, but had one been included it would make it very hard to use and access. It is decorated with 2 stickers along its panel wall which look good, but I feel that Lego missed an opportunity by not including stickers on the opposite side of these panels that could have represented the carbon freezing chamber and weapon locker. Yes, that&#39;s right, I actually wanted more stickers.&nbsp;</p>

<p>You also get two bounties in carbon freezing that neatly slide into holders so that they do not shift during flight. These are simple tall bricks with stickers on them and are clearly inferior to the well designed Han in carbon, but they also are much smaller and therefore give you a lot more interior space to play with.&nbsp;</p>

<p>&nbsp;The other really tight space towards the front of the ship can be used to store the three missiles that come with the set, meaning if all three are here, the two spring loaded shooters are empty, but I do like this feature for both storage and not accidentally losing missiles that are loaded.&nbsp;</p>

<p>Beyond that the rest of the interior is open, and both sides and the back fold down to give you easy access to all of it. Now access isn&#39;t all that easy as it is difficult to squeeze you fingers with minifigures into the space, but it is doable, and you can hold quite a few minifigures inside, although IG-11 has to bend over.&nbsp;</p>

<p>on top you get a cockpit with two red seats and a printed 1x2 tile for the controls. While I love the cool window brick that encloses the set, the interior of the cockpit is probably the only disappointment here. The red seats just seem to be out of place in such a bright color, although I do appreciate how Mando&#39;s cape fits over them. I also would have liked to see an old Classic Space movable antenna brick as a control to represent the knob that becomes Baby Yoda&#39;s toy. It would be difficult to put one in without replacing the 1x2 tile, but I may need to do that.&nbsp;</p>

<p>Behind the cockpit is storage for Mando&#39;s blaster,&nbsp;as well as a second weapon, perhaps a dark saber? Then behind that is a very small but effective escape pod. On either side are well disguised launchers for the spring loaded shooters.&nbsp;</p>

<p>Besides that the engines look fantastic as does the way the front of the ship is built. Underneath you have three skis for the ship to land on although they are off centered due to there being an even number of studs underneath. I feel like this little detail should have been rectified. You also have an unfinished row of bricks underneath the wings that hold up the engines. Now this is only visible from below as the wings and engines hide it, but this too is something that could have easily been covered up.&nbsp;</p>

<p>Overall</p>

<p>I think this is a wonderful set, and the fun and engaging build, the accuracy and playability of the model, and the wonderful minifigure collection make it a must have for any Mandalorian fan.&nbsp;</p>

<p>Now given that the Ghost from Rebels was only produced once and now is prohibitively expensive to get on the second hand market, I would say that if you are enjoying the Mandalorian (and who isn&#39;t) and think that you would like to own a Razor Crest, I wouldn&#39;t hesitate to get this set. You will certainly be glad that you picked it up. Of course you will want to at least add Cara Dune from the AT-ST set as who knows if she will ever be available again, I imagine that Ahsoka&nbsp;will be the next must have minifigure for this series and no doubt Lego knows that.&nbsp;And of course we can only hope that Lego releases a microfighter of Kuiil on a blurrg that can fit inside the ship, and if it&#39;s too few parts they can include a floating stroller!<br />
&nbsp;</p>

<p>I have spoken.&nbsp;</p>
",TRUE,5,5,5,5,5
"Lukazade2012","2020-09-13T09:24:22.897Z","Awesome Quality Build","<p>This was an awesome build experience with very nice detail in the finished model. As a fan of the Mandalorian series, I think this set complements the Razor Crest very well. Only suggestion would&#39;ve been to replace the biker scout with Kuiil minifigure. The missile storage bay on the left front side of the Razor Crest is a nice touch. I would highly recommend this set as a nice addition for collectors, Star Wars and Lego alike.</p>
",TRUE,4,5,5,4,4
"lukaszsw","2020-11-06T15:05:27.707Z","one of the best set to play with","<p>It doesn&#39;t look like it but the set is very big and has a lot space for figures inside. Actually the included figures fill up only half of the interior or less!</p>

<p>It has a lot of compartments to put figures and accessories in:</p>

<ul>
	<li>main cockpit</li>
	<li>weapon compartment behind the cockpit</li>
	<li>sleeping compartment and arrows compartment below the cockpit</li>
	<li>entire back section opening (though you can open just back hatch, or just side doors</li>
	<li>carbonite holding area with two blocks (with stickers)</li>
	<li>escape pod with space for one figure.&nbsp;</li>
</ul>

<p>&nbsp;The weak points are - front part below cockpit and front engine parts tent to fall off easily. The main interior is a little low for IG-11 figure and it is hard to put him in. The set could be a little cheaper. I&#39;ve got with a discount but at 114 euro it was still quite expensive.&nbsp;&nbsp;</p>
",TRUE,5,5,5,5,5
"DBrick","2020-09-14T19:01:13.697Z","Best 2020 set IMO","<p>I&#39;ve been waiting for this set since they announce it. I preordered it and as soon it arrives I built it.</p>

<p>AMAZING is the word that better describes what is this Razor Crest. First&nbsp;because of its own aspect. Ship is incredible and it&#39;s so accurate. Second, because of the build itself. It&#39;s been amazing to build the razor crest, despite the fact that there is some annoying 7x pieces in the last bag.</p>

<p>Minifigs are incredible too. The mandalorian, despite its non-beskar armor, the child, Greef Karga... and even the scout tropper (I do love scout troopers).</p>

<p>Overall, I think this is a 5/5 set.</p>

<p>The BAD things about this set are, from my point of view, two: (1) the stickers and (2) the price. I think this set is a little bit overpriced and I hate stickers. They make more accurate the ship, but its annoying to put 12 stickers on.</p>

<p>Last, but not least, the playability is amazing. My daughter enjoys this ship as one of her favorites.</p>

<p>NOTE: if you want to see the time lapse video of the whole build, you can go <a href=""https://todobrick.com/analisis-lego/lego-75292-the-razor-crest/#Analisis_del_Razor_Crest"">here</a> and watch the process.</p>
",TRUE,5,4,5,5,4
"CaptainKindling","2020-10-12T21:55:23.64Z","This is the way.","<p>At the time of writing, fans around the world are eagerly awaiting season 2 of The Mandalorian, and the continuation of Mando and The Child&#39;s story together.&nbsp; While season 2 will undoubtedly bring with it all new Lego tie-ins, to date there have only been two Mandalorian Lego sets: the AT-ST Raider, and the Razor Crest.</p>

<p>The personal ship of the titular character, the Razor Crest has become a fan favourite, possibly even standing to become a new Millennium Falcon to the latest generation of fans.&nbsp; As such it has justifiably been brought to life as a large-scale set, coming it at just over 1000 pieces for &pound;120.&nbsp; As far as price-per piece goes, this is leaning slightly more towards to the expensive side of average, but there is so much about this set which makes it worth every penny.</p>

<p>The build is split into 6 sets of numbered bags, accumulating in a 3-4 hour build.&nbsp; There are some very cool pieces included in this set to bring the shape of the Crest together, most notably around the bulky twin engines.&nbsp; There is also a brand new canopy custom made for this set, perfectly recreating the cockpit shape in a way that would have been extremely difficult to achieve otherwise.&nbsp; There are a few stickers in this set, as you&#39;d expect on a build of this size, but thankfully the canopy isn&#39;t one of them, so there&#39;s no risk of leaving conspicuous sticky marks on this beautiful new piece when attempting to get that perfect sticker alignment.&nbsp; Obviously stickers are a divisive point amongst the fans, but do give some added detail to the hull which again would have been tough to achieve just through bricks.</p>

<p>The initial part of the build comprises largely of Technic pieces, forming the bare bones of the Razor Crest on which the hull can take shape.&nbsp; Once this is done, the rest of the build is mostly made up of more traditional pieces.&nbsp; There is a little repetition to the build, most of which comes from the engines, as you may expect.&nbsp; But as these are the final part of the build, you&#39;ll most likely be feeling anxious to finish by this point and there isn&#39;t really any tedium to the process.</p>

<p>Out of the 50ish Star Wars Lego sets in my collection at present, this is only the second one I&#39;ve built with an error in the instructions.&nbsp; Interestingly enough, the other was the AT-ST Raider, leaving me really hoping Lego will up their game a little for the season 2 sets!&nbsp; As with the AT-ST, this isn&#39;t a build-breaking error, but is just an error in the &quot;list of bricks needed for this next stage&quot; box on one instruction.&nbsp; It&#39;s easy enough to spot and correct, so shouldn&#39;t cause any issues for most builders.&nbsp; My other issue with the instructions is one quite common to larger sets, where some stages will only feature the addition of one or two smaller pieces, but the instructions aren&#39;t clear as to where they&#39;re being added to, leading to a game of spot-the-difference with the previous frame to work out what you should be doing next.</p>

<p>Small instruction nitpicks aside, once you&#39;ve built the Razor Crest it&#39;s a sight to behold, and you absolutely feel like you&#39;ve got your monies&#39; worth.&nbsp; It&#39;s packed full of play features, with an accessible cockpit with space for 2 minifigures, a detachable escape pod, again with room for a minifigure.&nbsp; There are a pair of spring-loaded shooters, both of which are fully integrated and fired using buttons set into the top of the ship.&nbsp; The front side panels fold down to access the Madalorian&#39;s sleeping quarters on one side, and a small storage area for weapons and spare missiles on the other.&nbsp; The rear boarding ramp lowers, and the rear side panels can fold down, all of which provide access to the cargo hold, which includes 2 of Mando&#39;s bounties frozen in carbonite.&nbsp; Unlike the Han in carbonite slab which comes with several Slave-I and Cloud City sets, these aren&#39;t moulded pieces, but are just flat slabs with stickers.&nbsp; While moulded pieces would have been a nice touch, the flatter ones don&#39;t really feel like they&#39;re detracting much from the set, and it makes them easier to slot into the provided spaces in the hold.</p>

<p>The minifigure selection for this set is also top-notch.&nbsp; Obviously you get the Mandalorian himself, but as with the AT-ST Raider, he comes with his episode 1 &amp; 2 armour, so no beskar for us.&nbsp; He also comes with a plain black head, so anyone hoping to see a little Lego Pedro Pascal will be disappointed.&nbsp; Aside from that, he&#39;s well detailed and a nice figure in general.&nbsp; You get Greef Karga, who at present is still exclusive to this set.&nbsp; He does have a nice torso print and and a reversable head with two expressions, but the figure is let down a little by having plain red legs, with no printing at all.&nbsp; Then there&#39;s IG-11, mostly consisting of grey battle droid parts, but a decent figure nonetheless.&nbsp; The Scout Trooper is a great minifigure, with nice torso and leg printing, and a fantastic helmet mould.&nbsp; Growing up on Return of the Jedi, the Scouts are my personal favourite Imperial troopers, and this one really does them justice.</p>

<p>And of course the most eagerly awaited minifigure: The Child, or &quot;Baby Yoda&quot;.&nbsp; The box art doesn&#39;t do justice to how small he is, and he&#39;s just the right size to clip onto one of Mando&#39;s hands to allow him to be carried around.&nbsp; The head is nicely detailed and slightly rubbery, giving a bit of flex on those adorable ears.&nbsp; Due to his small size, the rest of his body is cast as a single fixed piece, so the only posability on the little guy is in turning his head left and right.</p>

<p>Overall, there is very little bad I can say about this set, and am happy to rate it 5 stars in every category.&nbsp; As mentioned, there&#39;s a slight error in the instructions, but nothing to justify marking down what could well be the best Star Wars Lego set of 2020.</p>
",TRUE,5,5,5,5,5
