"author","datePosted","title","review","HTML","overall","parts","buildingExperience","playability","valueForMoney"
"zanfar","2020-11-24T01:58:51.91Z","Solid Star Wars Offering","<p>Let&#39;s be honest, you&#39;re buying this for The Child nanofigure. I will admit, the figure is quite cute and a nice addition to my collection. The Mandolorian figure is also well done with lots of detail. The rest don&#39;t really tickle my fancy, but there are a lot of nice details and improvements over previous models if that&#39;s your jam.</p>

<p>The box is great; I like that kits seem to be moving to a thinner box with more front/back real estate. The contents are exactly what you expect: a series of numbered bags with a few loose parts and an instruction book. A first for me, the instruction book was also bagged, which is nice protection against bent corners.</p>

<p>The build is well-thought-out if a bit slow. There are several cases of sequential steps adding only one brick which has always annoyed me, as well as a few points where I thought the steps ought to have been reversed. There is also a typo on step 109 where the legend calls for a single brick, while the visual instructions (and later steps) clearly show two bricks being placed. The same caveats for any ship or star-wars build apply: lots of left-right, symmetrical duplication, and lots of the same color.&nbsp; The double-symmetry of the radial, side-by-side engine nacelles were particularly tiresome--but that&#39;s the cross us space collectors bear. Otherwise, the build is relatively enjoyable, with lots of angles and hinges without being overly complicated.</p>

<p>The final model is a solid 80% for me. It&#39;s swoopable, but the nacelles are a bit fragile for aggressive play. The spring-loaded blaster things (the LEGO weapons that fire a bolt, not a stud) are better integrated than any model I&#39;ve seen before; I don&#39;t use them, but I&#39;m not mad they exist on my model. The firing mechanism is quite ingenious as well--which was quite a nice surprise since they are built rather early in the process and seem like a very flimsy feature before you understand the purpose. The iconic bunk and child play area is modeled, as well as carbonite storage. The rest of the interior is bland but functional.</p>

<p>My only real issue with this model is that I&#39;m not sure who it&#39;s made for. The features and size imply a play kit, but the price is a little above what I would expect a pre-teen to have the budget or gift credit for--but I might just be out-of-touch. Also, the blasters make me think of dogfights, but I&#39;m not aware of any other vehicle kits in this universe. Perhaps we&#39;ll see a folding tie fighter with Moff Gideon or a small set of speeders with other memorable characters in the future. The price point and TV show audience make me think this should be targeted at AFOLs--something the price-per-piece supports as well, being in the range of UCS models. However, the ship is just a little small to truly satisfy at that level. It&#39;s below minifigure-scale, so while the ship&#39;s interior is fairly well used, it&#39;s mostly an open or static area. I would have liked to see a bit larger ship that allowed for a better-working cockpit or functional landing gear. I would easily trade the escape pod for a speeder or a transport pod for The Child.</p>

<p>&nbsp;</p>

<p>In all, I&#39;m not dissatisfied with the purchase, but I would advise others to wait for a sale or other promotion. It&#39;s a great model for those that must have some Mandolorian models, but there are better, more playable Star Wars sets out there.</p>
",TRUE,4,3,4,5,4
"Lobo_da_boss_","2021-01-04T21:03:26.89Z","Incredible build packed with features and detail but the figures could uses some work ","<p>Opening;</p>

<p>( Spoilers for a reveal in&nbsp;the Mandalorian season two&nbsp;but not to do with this ship a character included )</p>

<p>The Razor Crest was my big Christmas present of 2020 in terms of size and may be my favourite set of all time , the build is unmatched in size and detail and accuracy for the scale , unfortunately though , the Minifigure department whilst being good could do with some switching and adding .</p>

<p>The Minifigures-</p>

<p>The minifigures are good first starting with Din Djarin himself the Mandalorian he is reused from the 2019 AT-ST raider which wasn&#39;t accurate to that episode that the set was based off and isn&#39;t accurate to the one that you can infer this set is from , he has a gun metal grey Mandalorian helmet (too dark of a colour for his helmet but thanks 75299) , an unprinted black head , a dark grey thin cape , a torso with his chapter 1 a bit of 2 and 3 armour in excellent detail , his legs continue that armour to great effect , he wields his pulse rifle using a small blaster pistol attached to a dark brown lightsaber hilt with a black clip on the end , next we have the man Baby Yoda/The Child/Grogu whatever you want to call him he has a printed sand green head mould in rubber and a printed dark tan baby torso with not much but enough printing , next we have Greef Carga he has Finns hair in black , a smirking face and a grumpy one , his torso is very nicely detailed unlike his legs which are for some reason left blank , he wields two standard small blaster pistols , next we have IG-11 he has a printed 1&times;1 dark grey cylinder attached to a cone and clip , then attached to a dark grey battle droid body with a clip at the back , one vertical and one straight arm and some stationary dark grey battle droid legs , he wields a standard blaster and a long rifle , next we have a scout trooper he has the amazing dual moulded helmet which was introduced in 2019 , a lex Luther head and some continuous armour printing from torso to legs , he wields a standard black small blaster pistol and finally they are not really Minifigures but there are two carbonite Minifigures included they are stickers on 1&times;2&times;5 dark grey bricks one appears to be a mithral and the other a stubble bearing individual they are both tiled off at the top .</p>

<p>The build-</p>

<p>The build is a very interesting shape so I really don&#39;t know where to begin but here goes , the sides are attached with clips and use a big light grey panel on each side , with grilles at the top in dark grey and different shaped slopes at the base to show the area where the landing head retracts to in the show , toward the end of this panel there are a number of hinges behind to securely connect an angled 8&times;8 light grey plate which lines up great with the top level and makes a great Segway into me talking about the rear boarding ramp which is between both large panels , it is built on a dark grey 6&times;8 plate with angled plates ontop to create the necessary curve for the exterior panels to be flush together , there is a hinge connection at the base with two light grey 2&times;3 tiles securing them in place whilst two dark grey 1&times;2 grilles make for more detail , before the main side panels you have the side boarding ramps which are built on 4&times;6 dark grey modified plates with bars at the base and a 4&times;4 light grey tile with four studs used for a sticker showcasing some of the ships signature yellow stripes but the stickers for the stripes are in dark tan which I think works just as well , and the panels underneath the cockpit are attached with more secure hinges attaching them , these feature a thicker build with sloping right at the bottom and&nbsp;at the front , these also feature the main cannons of the craft with an elongated black technic pin for the tip of the barrel and a build around a long yellow technic axle there are two 2&times;2 light grey round bricks then some 1&times;2 dark grey technic bricks with jumpers and 1&times;1 dark grey round tile attached around some over hanging slopes for greebleing , at the rear there is a 2&times;2 round tile , a 2&times;2 light grey round brick and a dark grey astromech droid body with a half technic pin attached with another 1&times;1 dark grey round tile , underneath that&nbsp;there is a 3&times;10 light grey slope with more stripe sticker detail and above that a 2&times;3 light grey tile with strip sticker detail that lines up with the 3&times;10 , just above that , not attached to the retractable panel there are two 1&times;10 light grey slopes offset from one another that provide extra sloping towards&nbsp;the cockpit windshield&nbsp;, this is mirrored in both sides , at the very front nose of the ship there is a 4&times;8 black plate with a dark grey 2&times;4 tile and two 1&times;1 corner tiles in dark grey , around this there is a duplicated slope build made out of seven 1&times;3 half arches making the iconic rounded nose of the ship this is topped of with two 1&times;8 dark grey tiles so it is consistently smooth other than two light grey 1&times;1 hollow studs for what I think are the flood&nbsp;lights next to each other at the bottom of the front&nbsp; and finally there are three stations for landing gear all using the technic attached dark grey ski piece , there is&nbsp;one in the centre of the front&nbsp;and two embedded in with inverted slopes underneath the slope shapes on the main panels where the landing gear retracts&nbsp;in universe . Now the interior of the main cargo hold and the spots behind the cannon panels towards the front , when you pull down the main panels , the rear boarding ramp and the side boarding ramps you get access to a vacant but in a good way main cargo hold , on each side there are two essential and I mean ESSENTIAL technic lift arms on each side in light grey , just to note the main ship is built on a 2&times;6 light grey plate a pair of 6&times;8 dark grey plates and two 6&times;6 dark grey plates , the flooring is tiled and plates in light and dark grey , at the back near where the ramp closes there are two dark grey 1&times;3 plates and there is an assembly on some dark grey jumpers with a light grey 1&times;2 snot brick in the middle with a 1&times;2 dark tan tile on each side with a dark tan 1&times;2 cheese slope to wedge in the carbonite frozen individuals&nbsp;as this is where they go and when they are in they are pretty secure and that&#39;s it for this part of the interior . Now we move to the left side of the Razor Crest where if we pull down the panel which has the side cannon connected to , we reveal a sleeping quarters for mando and Grogu in the back there are two 1&times;4 light tan wall panels with stickers on each of them , the floor is fairly uneven as expected as this is just empty space Lego cleverly made use of , the bed has&nbsp;two light grey 1&times;2 jumpers then a 2&times;3 light grey tile with a 1&times;2 light tan cheese slope for the pillow , in the right hand side when you lower the panel that has the cannon you reveal , an almost empty room with just three 1&times;1 modified black bricks stacked ontop of one another with a vertical clip , Lego intend this to be the place for you to store you spare spring load but I use it as mandos signature weapons cupboard where I place his pulse rifle and the spring load when he is inside the cockpit and the floor in here is also as uneven as the sleeping quarters .&nbsp; Now moving onto the top of the craft starting at the back and moving our&nbsp;way towards the cockpit , the back area has a fairly decent overhang from where the cargo hold ends there are two&nbsp;modified 1&times;2 snot plates with a 1&times;4 dark grey plate with a 1&times;2 light grey grille attached in the middle and a light grey stud next to it on both sides , three 4&times;6 plates with studs around 3/4 sides are used to get a textured feel across the spine type area of the ship , one of the 4&times;6 is elevated compared to the others around here ,&nbsp;there are long thin light grey angle plates underneath these , they are 1&times;6 underslope dark grey bricks and a various amount of snot pieces used to attach 2&times;4 dark grey slope bricks and a 2&times;3 light grey slope brick with a 1&times;2 light grey grille to make the angle perfect for where the back panels all line up , then there is a spot for the heat vents where there is a hinge connection on each side of a 1&times;2 black rounded plate attached to jumpers , just before the hinges there are two 1&times;2 black grilles and there are two on each hinge anyway , straight in the middle there is an escape pod that will be covered later and it is surrounded by round bricks at corners , bricks and brick slopes at the areas&nbsp;facing forward , with dark grey tiles ontop with the corners using 1&times;2&times;1 rounded tiles . The body then breaks off into a strut on each side ,with more dark&nbsp;tan stripes now with plates not stickers with 2&times;2 light grey triangle tiles around with some slopes going down&nbsp;to a spring loaded shooter placement where to shoot it you push&nbsp;down on a clip with a grille tile ontop , then some angled dark grey plates at the front to get the slope back , a newer slope piece(&nbsp;introduced in the 20th anniversary slave I ) to get the correct upwards facing angle and these surround the spring loaded shooters and two light grey CMF stands are used on each side to cover up the vibrant colours beneath . Before we do the cockpit we are going to do the thrusters the back end has an inverted 2&times;2 tile in trans orange in the base of a gun metal grey barrel used for the outlets of the thrusters , these are attached to a 6&times;6 light grey rounded plate , with a large light grey round panel on the outward side of each panel with a large and detailed sticker to further the shape , there is a big technic wheel in dark grey each with the intakes consisting of seven similar builds attached&nbsp;to a modified 2&times;2 with bars , there is a 2&times;2 light grey dome brick in the centre , the inner side has a similar build to the nose at the very front using&nbsp;the same light grey arch piece with a 2&times;4 dark grey slope brick used to make the builds more flushed with the wings that they are connected to . Around the cockpit there is further sloping down with more 3&times;10 long slopes with more sticker detailing for the stripes on each side ,and the back of the cockpit uses a large windshield piece in light grey attached to a clip assembly so it can hinge back to reveal two clips to store some weaponry or tools , the windshield is a new piece for the set and has great print with a modified 1&times;2 light grey plate with a bar as a handle to remove it and access the inside , the interior has a 1&times;2 dark grey printed console cheese slope , tiles around the sides and there are two red chairs for mando and another figure . And finally the escape pod is very reminiscent of the one that Rey uses from the falcon in the last Jedi , it has a circular window with a roof with tiles and layered plates the sides have 1&times;2 light grey cheese slopes and the thrusters use dark grey 1&times;1 cones and it is attached to the outside&nbsp;with&nbsp;a single 2&times;2 red&nbsp;jumper on a beam that runs through the centre of the Razor Crest for structural support .</p>

<p>In conclusion -</p>

<p>this is the longest review I have written to date&nbsp;but it&nbsp;is&nbsp;of a set that I adore the build is fantastic and packed with room for the figures and looks fantastic on display , my only issues are with the figures where mando is not in his beskar armour and where&#39;s kuil he should have been here also the scout trooper should really have a speeder bike but luckily if you have or are getting 75288 AT-AT that comes with a speeder that can be used for this scout also Greef looks fairly incomplete without leg printing&nbsp; so overall I recommend it to any Lego star wars fan as it is just fantastic .</p>
",TRUE,5,3,5,4,4
"KnightOfRen","2020-12-29T18:34:22.103Z","A great building experience, and beautiful final product","<p><b>75292 LEGO Razor Crest REVIEW</b></p>

<p>As the release of The Mandalorian has caused lots of hype, lego is releasing a&nbsp;<em>small&nbsp;</em>wave of sets for the series. The largest and by far most eye catching is the 75292 Razor Crest.</p>

<p><strong>Building Experience:&nbsp;</strong>This was a fun build, it took me roughly 2 hours. There is some very interesting techniques used. Its easy (But still fun!) to put together, and it has a nice selection and use of parts as well. All I can say negatively is how repetitive putting the &ldquo;fins&rdquo; on the front of the engines&nbsp;<strong>14 times.&nbsp;</strong></p>

<p><strong>Minifigs:&nbsp;</strong>The Mandalorian minfig: This figure shows a great level of detail all throughout. The beskar helmet is gorgeous in the Gunmetal grey color. Mando comes with a pulse rifle, but the drawback is the fact that it does&nbsp;<em>not have a stock. oof size: Large.&nbsp;</em>He also does not carry a blaster pistol. But the detail, IMO, makes up for it. Greef Karga: In my opinion, this figure looks a bit too simple. But the torso piece is nice, I just feel a leg print would have been nice. The weapons seem about right, and the face is good. Overall a good fig, just could be better detailed. IG-11: This bounty droid slightly varies from previous IG-88 Minifigs, and it looks very nice. Compared to the show, it is accurate. The only downside is how&nbsp;<strong>hard it is to get the thing to stand upright&nbsp;</strong><em>sighs deeply.&nbsp;</em>Scout Trooper: This figure has not been changed much, as far as I know. But he looks excellent, and LEGO FANS HAVE VICTORY!! ANGRY CLONE HAS BEEN ELIMINATED AFTER YEARS!! This is a fantastic figure, and I hope to see more of him. The Child: To many, this is the star of the set. The child&#39;s adorable onscreen appearance has brought much hype when a LEGO version was announced. The figure&#39;s head is very nice, but going down, the body and legs are &ldquo;meh&rdquo;. It doesn&#39;t look like the thick, long robe that he had in the show. Looking past that, it is still a good fig, I just wish they had designed a new bottom piece.</p>

<p><strong>Design:&nbsp;</strong>This build makes clever use of many cool parts, including a brand-new canopy piece. This piece is printed as well. The build has many opening panels, but the annoying ones are the large side panels. 1) These panels did not open in the show 2) They often open when you do not want them to. I love the cockpit, its simple, but accommodates all the necessary characters for playing out scenes from Season 1 and 2. The main interior is empty, but it leaves room for an enormous amount of cargo (I added speeders, a ladder, fuel, and some crates already). The sleeping quarters look excellent, and leave room for Mando and Grogu to sleep. It also holds weapons behind the cockpit. The spring-loaded shooters are well integrated and do not stick out, which is great.A pretty good design overall.</p>

<p><strong>Value</strong><strong>:</strong>&nbsp;Is the set worth $130? The set is filled with mass, and it has good play value and features. In size/stature, it definitely feels like $130 worth of stuff. Even forgetting things like Price to Part ratio (Which is good enough in itself), this still has good value! Imo, it is worth the price of $130.</p>

<p><strong>Overall:&nbsp;</strong>This is a fun set with good features, and a nice build experience. I would highly recommend this to anyone into the Mandalorian and LEGO who likes cool build techniques.</p>
",TRUE,5,5,5,4,5
"npapag","2022-05-10T16:59:06.103Z","For collectors and more, a unique set.","<p>For any traditional collector, and while waiting for its UCS version, the Razor Crest essentially adds to its collection. Very &#39;solid&#39; construction, many Technics pieces, with many and fun game possibilities. It is true to the original design. The choice of minifigures is enjoyable: Mando, Scout Trooper, Greef Karga, IG-11 and Baby Yoda (AKA Grogu). Of course,&nbsp;it came at a premium price (EUR150) but it is worth it for anyone who has enjoyed The Mandalorian.</p>
",TRUE,5,5,5,5,5
"RundownPear","2022-03-22T15:55:33.533Z","The New Icon","<p>This is a very solid build with decent features for a good price.&nbsp;</p>

<p>The figures are fine. Greef, Mano, IG-11, Grogu, and the amazing scout trooper are all great additions but Quill really should have been included.&nbsp;</p>

<p>This set&nbsp;was one of the most fun builds I have done in a long time, it is just really satisfying to see it come together. It is really solid and has featured just about everywhere it can. The carbonate stickers are awesome and a nice homage to classic LSW. The escape pod is accurate to the source material and a very nice detail, the cockpit could have been more detailed but the printed windshield is great. The front part of the ship has the bunk and storage area, both of which are great inclusions; although the toilet would have been nice to see. The rear ramp and cargo area are large and sufficient enough to store many of Lego&#39;s speeder builds which is nice to see. The front of the exterior looks amazing but gradually gets worse as we move backward. Another 100 pieces could have added some more details to the rear but I am still happy with what we have now.&nbsp;</p>

<p>Overall his is a solid set for any fan of modern Star Wars. I hope we get more feature-filled hero ships like this in the future from Lego and look forward to future iterations of this icon.&nbsp;</p>
",TRUE,4,4,5,5,4
"Tristan_The_Lego_Lover","2023-02-05T13:32:30.517Z","GREAT STAR WARS SET!","<p>The Razor Crest (75292) is a great Star Wars Lego set. The outside consists of 2 lazer guns on the&nbsp;front, spring-loaded&nbsp;missiles on both sides between the engines which you push down on vents to fire. There is also an&nbsp;escape pod on the top of the ship. There are fold&nbsp;down hatches on the front sides the one on the left is a bedroom and the one on the right is a spring-loaded missile storage.</p>

<p>The cab consists of 2 seats and a printed computer. Behind the cab is a pull-up weapon storage for 2 weapons. The back of the ship consists of one ramp on the back two big fold downs on the side, and also two small ramps in front of that. Which means basically the whole back folds for room to play. Inside the back there is a carbonite&nbsp;rack with two carbonites and the fugitives&nbsp;printed on the carbonite&nbsp;the mando captures in season one of the mandolorian. Overall i think this set is great and would definitely recommend buying whether you&#39;re getting it for play or for display, it is great for both.</p>
",TRUE,5,5,4,5,5
