"author","datePosted","title","review","HTML","overall","parts","buildingExperience","playability","valueForMoney"
"A_Brickset_user","2003-12-02T04:53:50Z","Cool set, ut a bit flimsy (which can be fixed though)","Wow. Boba's Slave 1 was already great, so what does that makes this? Very cool copy of the movie spaceship, with great features and secret weapons.  It can open up hatches in different parts, opening up other weapons and features.

The set is a bit flimsy though, especially just below the cockpit area (the white part).  However, LEGO admits this and supplies a reconstruction kit with a few elements to make it sturdier.  So call their hotline if you require this.

All in all it's an utter cool set. Too bad only that it only contains special pieces...
",FALSE,4,0,0,0,0
"A_Brickset_user","2003-12-22T05:03:27Z","Really Great, A few problems","This set is Huge way bigger than i thought. It has loads of secret comparments,Guns,Grenades,jail compartment i could go on for ever. Thats the Really great part, Heres the few problems part. If you want to chase the jedi starfighter through the Astoroid field where do hold the thing. The slave 1 has no where what so ever to hold it. Ive tried everwhere and each time something falls of. The figs are great and Jango looks cool with his Jetpack. And Young Boba fett is GREAT. You may not know but i LOVE the use of short legs like the ewoks. But Bobas hairstyle does make him look like a girl. Whats up with that.Good figs, Good size Good set.",FALSE,4,0,0,0,0
"A_Brickset_user","2004-05-25T05:59:36Z","Awesome for the size and colors","This set may be a little awkward to hold, but it is really a fun build.  The pieces are great and the way the cockpit platform turns to balance with the ship when it is held upright is a cool feature.  Should have been $10 cheaper, but still a great buy.  Really wide array of colors and lots of small compartments to store equipment.  At least a third larger than the original!!",FALSE,5,0,0,0,0
"A_Brickset_user","2004-07-19T18:51:49Z","Good Set, Nice parts and minifigure","This is a great set, it have a lot of new pieces that I have never seen before, the color are great and are also new, it have a nice system for turning the wing ant the cockpit at the same time that is quite claver, the ship look good in the two position that you can put it, 
The two minifigure are great; I like Boba whit the short legs.
It had a lot of moving parts.
It is a great set but it deserve a 9, I think that my only reason that I don’t put a 10 it is because I bought at the same time that the 4504 Millennium Falcon  and it doesn’t compare to that set.
",FALSE,4,0,0,0,0
"A_Brickset_user","2004-09-18T14:34:19Z","cool set","It's Fat! Best word to describe it. At least twice as big as bobba Fett's slave. Nice colors, nice bricks, great minifigs.

It also has a lot of compartments and some kind of &quot;rescue box&quot; attached under it (I don't remember this in the film though...). Maybe a bit pricy, but you should be able to get it on ebay for less money!",FALSE,4,0,0,0,0
"A_Brickset_user","2004-09-25T13:19:07Z","EXCELLENT!!!","This Set Is By Far One OF Lego's Finest! I Just Love The Structure. It Has Great Features Such As A Prisoner Compartment (removeable) Hidden Missiles, Rotating Gun Turrets, Bomb Chamber And Much, Much More! The Minifigs Are Great Too! Building Time: 1-2 hours. Great Set To Play With! Well Worth The Money",FALSE,5,0,0,0,0
"A_Brickset_user","2004-10-14T08:27:20Z","realy good set","this is overall a good set.  i found gorgalacs reveiw realy helpfull but o well. i had this set once but it broke and i lost most of the peices.   rite now im saving up $24 to buy off amazon. it has lots of compartments, a jail cell in back that kan be removed and replaced magneticly, a litle place to hold bombs, another to hold jango's blasters, some secret hiden rotating blasters, and much, much more.realy good set.",FALSE,4,0,0,0,0
"A_Brickset_user","2004-11-01T22:12:25Z","WOW!!!!!!!!!!!!!","I LOVE it, it waas by far worth the money I paid (i did get it for sale at Lego Shop at home for $48 including shipping handling and tax- Canadian dollars) This set has many unique pieces and is filled with hidden gadgets. I did have to make &quot;a few special modifacations myself&quot;
Well all together one of the BEST!",FALSE,5,0,0,0,0
"A_Brickset_user","2004-11-25T18:21:08Z","I like I like...","When I saw this set I wasn't sure whether to get it or not. And after a confusing incident where I couldn't find a certain piece which took about half an hour out of my build time this is a great model. While a difficult set to build compared to a lot this size, well worth the effort. It has a resuce thing attached with magnets, while I alos can't remember it in the movie it is a great addition as it adds playability, hard to hold, but mine seems fine if you hold it in flight mode in you hols it as if you hold a bottle of coke or something. Jango is one of the coolest lego figures if you ask me with the interchangable heads.",FALSE,4,0,0,0,0
"A_Brickset_user","2004-12-05T13:18:02Z","ITS ONE OF THE BEST SETS THERE IS, HURRY TIME RUNNING OUT.","WHEN I BOUGHT THE SET I LOVED IT.IT HAS MANY COOL OBJECTS
SUCH AS THE ROTATING LONG RANGE BLASTER CANONS,INTERCHANGABLE HEAD(JANGO FETT),HIDDEN PRISON CELL,
HIDDEN CANONS AND HYPERDRIVE.I RECOMEND THIS SET TO ALL!",FALSE,4,0,0,0,0
"A_Brickset_user","2005-02-03T16:57:39Z","My favorite lego set!!!!","        This 9is absolutely the bomb! It is by far the best ship I have built and surprisingly enough, it is quite easy to hold! The ship is equipped with twin, pivoting heavy blaster cannons on the bottom, two long range ion cannons that can sweep into the fuselage. It has siesmic charges, a fuel tank, and torpedoes hidden within the fuselage! Jango is the best minifig, You can switch his head around for regular casual mode, and switch it around for the Jango Fett battle mode! Bona is nice but I sometimes despise those little legs. It is an extremely cool build with tons of large, curvy pieces and a humongous cockpit canopy. The stabilizer flaps on the sid are nice and if you turn those, the cockpit turns as well. A marvel of lego, a complete masterpiece by piece!It has some great pre-printed decals like on the back rim, and on some yellow tiles on the flap armor. Alot of pieces flip and show the innards and something hidden within! There isnt much walking room inside of the ship but it is just a  truckload of fun. I would recommend it for ages 10 and up, you wouldnt dare break this. The little cabinet pieces hold Jango's blasters, and they arent loudhailers!!!!! Jango is my favorite character! He is totally unique and awesome, I somehow like him more than Boba but oh well. This is a job-well-done and it has tons of waiting surprises in the construction. The cockpit is also very roomy, so you can fit a whole ton of controls in there. I fit a huge, green HUD screen from Island-Stunts, a lever, a small button tile, a TIE Fighter controller, and a regular control that came with the set! This is a super-D-duper set and I just loved it! Get it now! It may be too late! 
A storming, excellant, presto, exquisite 10!",FALSE,5,0,0,0,0
"A_Brickset_user","2005-02-19T12:32:49Z","WICKED!!!","Tis was the coolest set ever! it has cool mini figs and WAck peices. I loved it and it was SOOOOOO cool, Jango's wicked coz he has his jetpack and helmet. His head changes from &quot;casual&quot; To &quot;super kill bounty hunter&quot; mode. It was cool and I loved it, I also had the millenium falcon but this was SOOOOOO much cooler.

Pros: cool every thing, good buy, HUGE!, lego magnets.

Cons: a tiny little tiny bit flimsy (it broke once)
Best buy ever!",FALSE,5,0,0,0,0
"A_Brickset_user","2005-02-20T10:54:35Z","&quot;well we wont be seeing him anymore&quot;","one of the best set ever. so many cool things, and it is big enough it is not always it is that, boba fett`s slave one was like ten times smaller than it should be. nice minifigs i am a big fan of jango and he is impressive made but one flaw it is sad that you cant take his jetpack of and let the  helmet stay but thats that. i recomend this set to everyone it is a must you have to buy it no matter the cost.                                ",FALSE,5,0,0,0,0
"A_Brickset_user","2005-03-29T14:50:51Z","GREAT set","This set is really good. The compartments and the unique pieces. The ship needed the real place where the missiles were (near the bottom rotating guns) and a bigger cockpit for Boba (he is so close to Jango). All in all the set was really good.",FALSE,4,0,0,0,0
"A_Brickset_user","2005-04-01T16:35:58Z","Excellent AOTC set- Get it NOW, since prices for MISB examples are on the rise.","(I got this set some time after it was discontinued, and already it had apreciated to above its MSRP, 50 USD.  For 358 rare, unique parts, though, the price was right.)

This set is a must for any Ep. II lego fan, with its varied and accurate (check your Ep. II Incredible Cross Sections book) complement of weaponry, and a dramatic improvement over the hapless year 2000 slave I.  For starters, the forward laser cannons located at the bottom of the hull have a ratcheting, almost-360 degree rotation.  It has two hidden 4-barrel laser cannons that pop out of hatches located directly below the tan &quot;wings&quot; of the ship--- Those laser cannons are a cool touch.  Near the forward laser cannons are two dk. grey cabinets that hold Jango Fett's blaster pistols, which are the same as the ones from the Wild West sets, not new moldings. :( 
  Another hidden weapon that Slave I holds is its cache of 2 concussion missiles, located benath the white panels that make up the front of the hull.  Finally, this ship has the ability to drop 3 trans-orange seismic charges, but only when resting on its &quot;back&quot;, not in upright flight position.  
  I have few quibbles with this set.  Here they are:
The seismic charges are orange, not blue, their color in Ep. II, the use of yellow bricks is far too extensive, the cockpit windscreen doesn't have a hinge for easy entry, and the set is *somewhat* flimsy.  ",FALSE,5,0,0,0,0
"A_Brickset_user","2005-04-16T05:42:30Z","THE 2ND BEST OF THE YEAR ","I GOT THIS SET 2 YEARS AGO AND I STILL LOVE IT I MADE SOME CHANGES SO IT LOOKED MORE LIKE SLAVE 1 WHEN JANGO STOLE IT FROM OOVO 4 IN THE VIDEO GAME JANGO FETT BOUNTY HUNTER 
EXEPT FOR THE CHANGES I HAD TO DO IT WAS GOOD FROM THE START",FALSE,4,0,0,0,0
"A_Brickset_user","2005-04-16T19:40:40Z","it was cool but lego could have done alot better.","This set was no were near what i thought it would be like, I thought it would be almost the same as the first one except the right size. Yes it now is the right size but the wrong thing they did that made the ship look not like the one in the movie was the wings. were should i start, o lets see.... the wings only look good when slave 1 is in landing posision, the wings should be almost like a wedge and the thing conecting the wings to the ship should be straight wen flying not bent in an almost 60 degree angle. anyway enough of the bad stuff now for the good stuff about this ship, Jango is one of the best Star Wars characters ever (besides Vader, Boba grown up, and grievous) the ship is now the right size and it realy looks good will landed, i love the hidden weapons and the storagde place and the prisoner cell is kinda cool but its better to be used as a sonic charge. still this set was really cool minis the wing thing. ",FALSE,4,0,0,0,0
"A_Brickset_user","2005-04-23T22:03:47Z","Jango Fett","I thought this set was a better than ok but not my favorite set. The cool part was that it came with a Jango minifigure.This set is obvisily bigger than the first one which is why that it cost thirty dollars more in the retail price than the first one. This set also has some kind of magnetic thing is an ok feature. Overall I think you should buy this set if it is still on sale I think it has been discintinued",FALSE,4,0,0,0,0
"jellylikepie","2007-07-15T23:34:55.84Z","The best set ever","This set is the best set I have ever had. It is also my favirote set. It comes with jango and boba (kid) minifigs. It also has hidden Twin ion canons. All but two wepons are hidden. The best part is the magnetic cargo hold. Over all I would recommend this set to any one.",FALSE,5,0,0,0,0
"Manxboi24","2007-08-12T16:11:53.63Z","Great set but...","It is a great set but it is really easy to break and the cockpit is kinda weird. I really like the missile launchers and the bomb compartment. Jango and Boba minifigs are cool too. 

                Overall
Plus if:
*you like Jango and Boba Minifigs
*you want to recreate the battle between this and Obi Wans Strarfighter

Minus if:
*you'd rather something less flimsy                                                           ",FALSE,5,0,0,0,0
"hustla187","2008-06-30T18:35:12.39Z","Jango Fett is Awesome!","I really like this set. The Slave 1 has very cool features like a moving cockpit, blaster cannons, and a cool color cordination. Jango Fett and the small Boba Fett only appear in this set, so if you want the minifigures, get this set. This is a perfect set with no problems at all.",FALSE,5,0,0,0,0
"legolord909","2007-08-26T14:25:06.27Z","Fantastic!","This is truly an amazing set!  I was really excited when I had enough money for this set.  Basically, that's the only downside; it's very expensive.  Either than that, it's perfect!  The rotating wings are great and the cockpit is nice and big.  Also, this set has tons of features including two little storage compartments, rotating blasters, and other missles that can be tucked away inside the ship.  One of the best features is the bomb-dropper.  It releaes three little orange bombs on the enemy.  On the whole, the ship is huge considering it only has about 350 pieces.  It also has many unique pieces which are worth getting.  But obviously, the best part about this set is the minifigs.  Jango is awsome!  I love the blue coloring on the helmet and body.  Plus, they give you Jango's normal face and a black face.  Little Boba is also a personal favorite of mine.  This whole set is just amazing!  Buy this one! ",FALSE,5,0,0,0,0
"Leggodt94","2008-04-03T17:42:46.857Z","Do not frett 'cause Jango Fett is in this set! ","Let me start off by saying that this set rocks! I mean, you can't get much more rare things than in this set. Let's see....aw yes! It comes with rare jango fett minifigure with helmet, pistols, and the works; oh, and his head has two faces: a black face for the helmet and his real face for his hair that he comes with!:D Also, it comes with rare young boba fett minifig too; however, his little legs can't bend which is okay. Now, on to the amazing model! Let's see his ship is MUCH better designed than the old Boba Fett's Slave I with rotating wings and a two-passenger cockpit. Also, the ship comes with other neat little extras such as hidden rockets and blaster cannons, dropping bombs, rotating guns, compartments for jango's hair and pistols, a magnetically connected box container in the back, and numbered bags for easy build. However, there is one small, tiny, little problem with the construction: in the beginning stages of the build, the model is very fragil and easily breakable. But, like I said, it's only a small, little problem. Over all, this set is great; and if you don't have this set then you're missing a vitally important part of your lego star wars collection. Great set!   ",FALSE,5,0,0,0,0
"smiley905","2008-01-06T22:12:01.733Z","awsome!","this set is awsome! this set has a bunch of realy cool features, but sadly a bunch of glitches, but none of them are that hard to fix or ignore. i can see how this ship would be a hard one to design. 

pros 
-bombs
-missles
-very rare and cool peices for the engine
-boba fett
-jabgo fett
-machine guns fold into the ship
-double rotating guns
-cool peices
-cargo hold
-cocpit spins when it lands or take off
-magnet included

cons
-bombs dont fall out unless you tip it backwards
-boba has the short non moveable legs
-the wings and the things around the wings are all hard to build and hard to rebuild after they break

this is a great set and has a tonne of features and playability! its awsome and id buy it if you ever see it, i got two for $30 each (CAN$) and gave one to my friend for his birthday",FALSE,5,0,0,0,0
"Pepper","2008-04-07T19:03:19.17Z","pretty cool","I got this set from my mom a few years ago. Well, onto the pros. and cons.<br/><br/>Pros.<br/>cool minifigs (Jango Fett and Boba Fett)<br/>cool missles<br/>magnets<br/>blasters<br/>2 little guns for Jango<br/>prisoner compartment<br/>bombs<br/><br/>Cons.<br/>wings sometimes fall off<br/>I lost Boba<br/><br/>Overall, pretty cool set. Good for Star Wars lovers.",TRUE,5,5,5,5,4
"rabk295","2009-02-05T17:53:34.623Z","Good design.","This is overall a great set. The one thing that could be better about it would be using the UFO pieces instead of the ones they chose. These pieces make it to bumpy and layered. The minifigs it comes with are nice, but I think it should come with Obi Wan. I know he comes with his starfighter, but having this set come with him would give it a better playability rating. The one I give this set is a 9.2. The piece that they use for the hyperdrive is also very nice. Putting that in there is a great addition. They way the seat moves when you move the ship is very cool, too. One last flaw is that the two curved black pieces next to the ""wings"" fall off very, very easily. Other then that, this set is great. ""Santa"" got this off ebay for me for a very good price. BUY THIS SET! IT'S WORTH IT!",FALSE,5,0,0,0,0
"daffy","2009-02-06T07:16:15.763Z","Best set made!","It is very cool,  especially with my favorite character,  Jango Fett .
I like Boba too,if you get set 7143 it is more fun! do not think about the prices if you see it get it! (ON EBAY)
Unfortunately,  it breaks very easily.

Pros:

Jango 
Boba
bombs
rockets
cockpit

Cons:  (once again) It breaks very easily.
",FALSE,5,0,0,0,0
"AFOSL","2009-05-03T18:15:29.437Z","An Excellent 2nd Try For This Challenging Design.","2002 was an excllent year for the Star Wars Lego collector.  A new film had just been released, giving Lego another year of great new models, many of which included the new designs in brick and whole new range of colours.  It was an exciting time, and with the release of the new film, the Lego Star Wars models were proving more popular than before.
One ship to enjoy this popularity was Jango Fett's Slave 1. 

From looking at the box art, you could instantly see that this model was very different from the earlier one released in 2000.  The box gave you a glimpse of what was inside - the new bricks, the authentic colours, the added details.  What it didn't give away was any real hint of the model's size.
No doubt a lot of people would be comparing this model to the first Slave 1 and had a lot of questions that needed answering.

The build starts, as usual, with the assembly of the minifigures.  Two are included in this set - Jango Fett and his young son, Boba.  Both figures are unique to this set, at the time of writing, Jango in particular, being of special interest for the collector.
Jango uses the same jetpack and helmet mold found on the earlier adult Boba minifigure, but is silver instead of green.  The helmet markings are painted on in black and two shades of blue.  The helmet slips over a black head piece as before, but Jango's head piece is printed on one side with Jango's face.  Remove the helmet/jetpack, twist the head, add the included black hair piece, and voila! You have a Jango Fett that can move around without all of his combat gear strapped on.  A neat little touch.
Jango's Torso is grey with silver armour plates painted on.  Very flash!  His arms are purple!  
This colour seems to have been added especially for the Jango Fett figure and the larger Technic model of Jango, released around the same time.
Jango's legs are also moulded in this new funky purple colour.  A very unique mini figure, indeed.
The young Boba figure is less spectacular, legs and torso molded in baby blue, the torso having some detail paintwork to depict the tunic Boba wears.
Boba's legs are of the short, non posable type and his hair is of the long type, not often seen in the Star Wars Lego universe.  It is molded in black, of course.

Moving on to the ship, and construction begins with the lower rear portion of the model where you are instantly introduced to a new part in a new colour - rounded slopes in dark blue!
As construction moves on there is some use of standard bricks in standard colours - bright reds, blues and yellows.  These turn out to be hidden in later stages, so don't panic.  This part of the build is in 16 stages and concentrates on the loading ramp and bomb bay doors.  These are mounted on click hinges, so won't fall open willy nilly.  Included here are 3 transparent orange globes (siesmic charges), more dark blue elements and even more new round slope pieces in another cool new colour - sand green!
The next stage deals with the lower front part of the ship and poses no problems in construction.  Once again, plenty of dark blue and sand green slopes are used, as well as white slopes and round bricks.
This front section then connects to the back section to form the overall base of the model.  Things are shaping up.
The next stage of construcion is fairly lengthy and deals with the bulk, center section.  Here you are introduced to some Technic axles and two 10x1 Technic bricks.  Along with a magnet, this little part of the construction seems to have no purpose, but lets move on.
This little section adds bracing to the conjoined front and rear sections you built earlier, and it is now apparent that the Technic axles will be used to attach the stabilizer wings.  But what is that magnet for?
This middle section also contains the cockpit which is mounted on  the Technic axles, so it can rotate with the stabilizer fins, thereby staying upright at all times.  What's more, both figures will fit into this cockpit at the same time as there is plenty of room. 
The rest of the middle section fills up with more bricks of various shapes and colours, including opening hatches which conceal hidden cannons.
At this stage, you end up with a rather non descript looking lump.

Moving on to the sides of the model and you are faced with a flimsy construction with the new slope pices in black, mounted vertically - two on each side of the ship.
Next up, you move briefly on to the underside of the ship and finally find out what that magnet is for.  It seems Jango's Slave 1 comes complete with a prison cell.  This is a box with hinged doors on either end.  On top of the box sits a magnet.  This small construction then slides into place inside the ship, from underneath, held by the other magnet.
This is a nice design which will add a lot of playability for younger collectors.

Moving back to the sides of the ship, and it is now time to build the stabilizer fins.  These are nicely detailed, using a combination of basic bricks and plates, Technic, and what look like parts borrowed from Bionicles.  I could be wrong. These are all moulded in the relevant colours - Tan mostly, with some greys and details in yellow.  
You are instructed to build two of these, and they are then attached to big grey cones.  The finished constructions then slide over the Technic axles, one either side of the model, between the flimsy upright black slopes.  It actually looks very realistic, and shows how much attention to detail Lego have put in to this Slave 1, and shows that it the design really benefitted from the use of the newly designed bricks.

Moving to the underside of the craft, you are required to add seven exhaust ports and a large radar dish at the front.  These also raise the craft off the ground a little and lift the prison cell clear so it is fully supported only by the magnet.

Topside again and it is time to add the tail end of Slave 1.  This isn't just a block thrown together with only the absolute minimum number of bricks.  Not a drop of imagination is wasted.
This top rear section contains storage compartments and an engine which is accessable via hinged service hatches either side.  It also houses the four cannons which are mounted on plates with an axle underneath.  Two cannons per plate.  These then slot into a brick mounted either side of the tail.  The cool thing is that these cannons don't swing freely, but click into place as you turn them.  This allows you to line up the cannons perfectly either side, making for a much more eye catching model.
This tail construction then fits into place on top of the rear of the ship and to finish things off, a large one piece canopy in a transparent smokey colour sits over the front half of the ship.

Overall this is a very enjoyable ship to build with engaging instructions, up to Lego's usual high standards.
Only two things stand out in my mind as slight flaws.  The first is the flimsy design of the stabilizer guards - the black upright slopes - which tend to fall off if the ship is held wrong.  The other gripe is minor.  Although the scale of the ship is better than that of the 2000 model, and the overall design is excellent and life like, I can't help but think that the ship is a little too short and stubby.  It needs stretching out by a few studs just to give it a more balanced appearance.
Otherwise, this is an excellent model and well worth it's original price tag.  ",FALSE,5,0,0,0,0
