"author","datePosted","title","review","HTML","overall","parts","buildingExperience","playability","valueForMoney"
"Darthblaker74744","2010-07-18T12:35:41.423Z","FREE! (Again) ","this is the second&nbsp;Lego&nbsp;toy story promotional set that was free in the Sunday Mirror (£1 which is a bit more than&nbsp;usual).<div><br></div><div>pros:&nbsp;</div><div><ul><li>Buzz&nbsp;lightyear</li><li>space rangers&nbsp;sloping&nbsp;brick</li><li>purple 'cheesers'</li><li>goes well with set:<span class=""Apple-style-span"" style=""font-size: 11px; line-height: 14px; border-collapse: collapse; ""><a title=""View full details of set 30070: Alien Space Ship"" href=""http://www.brickset.com/detail/?Set=30070-1"" style=""margin-top: 0px; margin-right: 0px; margin-bottom: 0px; margin-left: 0px; padding-top: 0px; padding-right: 0px; padding-bottom: 0px; padding-left: 0px; border-top-width: 0px; border-right-width: 0px; border-bottom-width: 0px; border-left-width: 0px; border-style: initial; border-color: initial; outline-width: 0px; outline-style: initial; outline-color: initial; font-size: 1.1em; vertical-align: baseline; background-image: initial; background-attachment: initial; background-origin: initial; background-clip: initial; background-color: transparent; text-decoration: none; color: rgb(81, 171, 255); font-weight: bolder; background-position: initial initial; background-repeat: initial initial; "">30070</a>&nbsp;(as a sort of chase&nbsp;scene) &nbsp; &nbsp; &nbsp; &nbsp; &nbsp; &nbsp; &nbsp; &nbsp; &nbsp; &nbsp; &nbsp; &nbsp; &nbsp; &nbsp; &nbsp; &nbsp; &nbsp; &nbsp; &nbsp; &nbsp; &nbsp; &nbsp; &nbsp; &nbsp; &nbsp; &nbsp; &nbsp; &nbsp; &nbsp;</span><span class=""Apple-style-span"" style=""line-height: 14px; font-size: 11px; border-collapse: collapse; "">&nbsp;</span></li></ul><div><font class=""Apple-style-span"" size=""3""><span class=""Apple-style-span"" style=""border-collapse: collapse; font-size: 11px; line-height: 14px;""><br></span></font></div></div><div><font class=""Apple-style-span"" size=""3""><span class=""Apple-style-span"" style=""border-collapse: collapse; font-size: 11px; line-height: 14px;"">cons:</span></font></div><div><ul><li><font class=""Apple-style-span"" size=""3""><span class=""Apple-style-span"" style=""border-collapse: collapse; font-size: 11px; line-height: 14px;"">the rocket engine could be better designed</span></font></li></ul><div><font class=""Apple-style-span"" size=""3""><span class=""Apple-style-span"" style=""border-collapse: collapse; font-size: 11px; line-height: 14px;""><br></span></font></div></div><div><font class=""Apple-style-span"" size=""3""><span class=""Apple-style-span"" style=""border-collapse: collapse; font-size: 11px; line-height: 14px;"">overall&nbsp;I'd&nbsp;give this set a 9/10 and is a great&nbsp;edition&nbsp;to the&nbsp;Lego&nbsp;toy story brand.</span></font></div>",TRUE,5,3,3,4,5
"_add_um","2010-07-18T14:05:19.307Z","Great promo!","<p>I got this with the daily mirror ireland. I recommend this set to any one who is a fan of toy story. Its a great way to get a buzz lightyear figure without getting more expensive sets. I always thought the buzz figure chest/armor piece made him too bulky but in the end its a decent minifig.The space ship is nice but nothing special and has a generic feel to it. The front of the ship is printed and is the same piece used in the build-a-buzz set. Overall this a nice addition to the toy story line.</p>",TRUE,4,3,3,3,5
"LEGOParadise","2010-10-06T13:08:11.563Z","Small But Amazing!","<p>This promotional Toy Story set is awesome! This is why:</p>
<p><br/><strong>Buzz<br/></strong>Buzz Lightyear has&nbsp;to be my favourite ever minifigure. He is made up of 7 fantastic pieces which include a new, very detailed head, new wings, Buzz's chest armour, a visor for the armour, a torso and, of course, legs. The detail is very&nbsp;cool from the Space Rangers symbol to the buttons on his chest.&nbsp;</p>
<p>&nbsp;&nbsp;&nbsp;&nbsp;&nbsp;&nbsp;&nbsp;&nbsp;&nbsp;&nbsp;&nbsp;&nbsp;&nbsp;&nbsp;&nbsp;&nbsp;&nbsp;&nbsp;&nbsp;&nbsp;&nbsp;&nbsp;&nbsp;&nbsp;&nbsp;&nbsp;&nbsp;&nbsp;&nbsp;&nbsp;&nbsp;&nbsp;&nbsp;&nbsp;&nbsp;&nbsp;&nbsp;&nbsp;&nbsp;&nbsp;&nbsp;&nbsp;&nbsp;&nbsp;&nbsp;&nbsp;&nbsp;&nbsp;&nbsp;&nbsp;&nbsp;&nbsp;&nbsp;&nbsp;&nbsp;&nbsp;&nbsp;&nbsp;&nbsp;&nbsp;&nbsp;&nbsp;&nbsp;&nbsp;&nbsp;&nbsp;&nbsp;&nbsp;&nbsp;&nbsp;&nbsp;&nbsp;&nbsp;<br/><strong>The Ship</strong><br/>Although this space ship didn't appear in the Toy&nbsp;Story movies, it has some fantastic pieces! The ship is&nbsp;very sturdy and&nbsp;has a very rare printed roof-tile with the Space Rangers logo on the front. This set has quite a few purple and lime-green wedges (one more of each colour comes with this set as spares) which you dont often find in sets.</p>
<p><br/><strong>Value<br/></strong>This set is great value for £1.00, not only that, but you also get a free Daily Mirror&nbsp;paper! <br/>&nbsp;<br/>Overall, this is a fantastic, great value set and if you have the chance to&nbsp;get one,&nbsp;get it!<br/>&nbsp;<br/>&nbsp;<br/>&nbsp;</p>",TRUE,5,5,3,5,5
"Popup","2012-10-14T18:19:02.597Z","Lego Toy Story 3 Set 30073 Buzz's Lightyear Mini Ship Build and Review","<span style=""color: rgb(34, 34, 34); font-family: Verdana, Arial, sans-serif; font-size: 11px; line-height: 14px; "">Hi everyone...</span><br><div><div style=""margin: 0px; padding: 0px; border: 0px; outline: 0px; font-size: 11px; vertical-align: baseline; color: rgb(34, 34, 34); font-family: Verdana, Arial, sans-serif; line-height: 14px; ""><br></div><div style=""margin: 0px; padding: 0px; border: 0px; outline: 0px; font-size: 11px; vertical-align: baseline; color: rgb(34, 34, 34); font-family: Verdana, Arial, sans-serif; line-height: 14px; "">I have purchased and reviewed this product in full, if you would like to see this product in more detail including a product build then please feel free to watch the video that I created to review this product in more detail.</div><div style=""margin: 0px; padding: 0px; border: 0px; outline: 0px; font-size: 11px; vertical-align: baseline; color: rgb(34, 34, 34); font-family: Verdana, Arial, sans-serif; line-height: 14px; ""><br></div><div style=""margin: 0px; padding: 0px; border: 0px; outline: 0px; font-size: small; vertical-align: baseline; color: rgb(34, 34, 34); font-family: Verdana, Arial, sans-serif; line-height: 14px; ""><b style=""margin: 0px; padding: 0px; border: 0px; outline: 0px; font-size: 13px; vertical-align: baseline; background-color: transparent; background-position: initial initial; background-repeat: initial initial; "">Click on Youtube Link Below to Watch the Build &amp; Review of this product.</b></div><div style=""margin: 0px; padding: 0px; border: 0px; outline: 0px; font-size: small; vertical-align: baseline; color: rgb(34, 34, 34); font-family: Verdana, Arial, sans-serif; line-height: 14px; ""><b style=""margin: 0px; padding: 0px; border: 0px; outline: 0px; font-size: 13px; vertical-align: baseline; background-color: transparent; background-position: initial initial; background-repeat: initial initial; ""><br></b></div><a href=""http://www.youtube.com/watch?v=Uc-p94xLFnA"">http://www.youtube.com/watch?v=Uc-p94xLFnA</a><br style=""color: rgb(34, 34, 34); font-family: arial; font-size: small; line-height: normal; ""><div style=""margin: 0px; padding: 0px; border: 0px; outline: 0px; font-size: 11px; vertical-align: baseline; color: rgb(34, 34, 34); font-family: Verdana, Arial, sans-serif; line-height: 14px; ""><br></div><div style=""margin: 0px; padding: 0px; border: 0px; outline: 0px; font-size: 11px; vertical-align: baseline; color: rgb(34, 34, 34); font-family: Verdana, Arial, sans-serif; line-height: 14px; "">I hope that you find the video that I have provided to be of help when purchasing this product.</div><div style=""margin: 0px; padding: 0px; border: 0px; outline: 0px; font-size: 11px; vertical-align: baseline; color: rgb(34, 34, 34); font-family: Verdana, Arial, sans-serif; line-height: 14px; ""><br></div><div style=""margin: 0px; padding: 0px; border: 0px; outline: 0px; font-size: 11px; vertical-align: baseline; color: rgb(34, 34, 34); font-family: Verdana, Arial, sans-serif; line-height: 14px; "">Thanks Popup</div></div>",TRUE,3,3,1,4,3
