"author","datePosted","title","review","HTML","overall","parts","buildingExperience","playability","valueForMoney"
"Ha876","2010-10-06T20:35:07.243Z","Smallish orange thing","This set is basically 17 orange pieces and 1 green piece for 2 bucks. There is really nothing special about this set. It is what the title says it is. The pieces are not bad though, but for 2 bucks, i don't think its worth it.",FALSE,2,3,1,1,2
"AETerry","2011-03-09T19:51:28.88Z","Halloween Pumpkin Review","<p>Strangely enough I got this in my stocking for Christmas...</p>
<p>&nbsp;</p>
<p>It's a good little set, I plan to set it aside for my Halloween decorations, it provided a quick, easy building experience for me. I suppose the best part is the ability to get several orange pieces that I just don't have a whole lot of. There's not too much you can do with it after words though except set it somewhere for display. Still, as a gift or small stocking stuffer, this was fun to get.</p>",TRUE,3,3,3,2,4
"Popup","2012-10-14T18:28:49.413Z","Lego Seasonal Set 40012 Halloween Pumpkin Build & Review","<div style=""margin: 0px; padding: 0px; border: 0px; outline: 0px; font-size: 11px; vertical-align: baseline; color: rgb(34, 34, 34); font-family: Verdana, Arial, sans-serif; line-height: 14px; "">Hi everyone...</div><div style=""margin: 0px; padding: 0px; border: 0px; outline: 0px; font-size: 11px; vertical-align: baseline; color: rgb(34, 34, 34); font-family: Verdana, Arial, sans-serif; line-height: 14px; ""><br></div><div style=""margin: 0px; padding: 0px; border: 0px; outline: 0px; font-size: 11px; vertical-align: baseline; color: rgb(34, 34, 34); font-family: Verdana, Arial, sans-serif; line-height: 14px; "">I have purchased and reviewed this product in full, if you would like to see this product in more detail including a product build then please feel free to watch the video that I created to review this product in more detail.</div><div style=""margin: 0px; padding: 0px; border: 0px; outline: 0px; font-size: 11px; vertical-align: baseline; color: rgb(34, 34, 34); font-family: Verdana, Arial, sans-serif; line-height: 14px; ""><br></div><div style=""margin: 0px; padding: 0px; border: 0px; outline: 0px; font-size: small; vertical-align: baseline; color: rgb(34, 34, 34); font-family: Verdana, Arial, sans-serif; line-height: 14px; ""><b style=""margin: 0px; padding: 0px; border: 0px; outline: 0px; font-size: 13px; vertical-align: baseline; background-color: transparent; background-position: initial initial; background-repeat: initial initial; "">Click on Youtube Link Below to Watch the Build &amp; Review of this product.</b></div><div style=""margin: 0px; padding: 0px; border: 0px; outline: 0px; font-size: small; vertical-align: baseline; color: rgb(34, 34, 34); font-family: Verdana, Arial, sans-serif; line-height: 14px; ""><b style=""margin: 0px; padding: 0px; border: 0px; outline: 0px; font-size: 13px; vertical-align: baseline; background-color: transparent; background-position: initial initial; background-repeat: initial initial; ""><br></b></div><font color=""#0000ee"" face=""Verdana, Arial, sans-serif"" style=""margin: 0px; padding: 0px; border: 0px; outline: 0px; font-size: small; vertical-align: baseline; font-family: Verdana, Arial, sans-serif; line-height: normal; ""><span style=""margin: 0px; padding: 0px; border: 0px; outline: 0px; font-size: 11px; vertical-align: baseline; background-color: transparent; line-height: 14px; background-position: initial initial; background-repeat: initial initial; ""><u style=""margin: 0px; padding: 0px; border: 0px; outline: 0px; vertical-align: baseline; background-color: transparent; ""><a href=""http://www.youtube.com/watch?v=Dbl7dmoEBEk"" title=""Link opens in a new window"" style=""margin: 0px; padding: 0px; border: 0px; outline: 0px; vertical-align: baseline; background-color: transparent; text-decoration: none; color: rgb(70, 103, 164); "">http://www.youtube.com/watch?v=tGK_OpOV2sU</a></u></span></font><br style=""color: rgb(34, 34, 34); font-family: arial; font-size: small; line-height: normal; ""><div style=""margin: 0px; padding: 0px; border: 0px; outline: 0px; font-size: 11px; vertical-align: baseline; color: rgb(34, 34, 34); font-family: Verdana, Arial, sans-serif; line-height: 14px; ""><br></div><div style=""margin: 0px; padding: 0px; border: 0px; outline: 0px; font-size: 11px; vertical-align: baseline; color: rgb(34, 34, 34); font-family: Verdana, Arial, sans-serif; line-height: 14px; "">I hope that you find the video that I have provided to be of help when purchasing this product.</div><div style=""margin: 0px; padding: 0px; border: 0px; outline: 0px; font-size: 11px; vertical-align: baseline; color: rgb(34, 34, 34); font-family: Verdana, Arial, sans-serif; line-height: 14px; ""><br></div><div style=""margin: 0px; padding: 0px; border: 0px; outline: 0px; font-size: 11px; vertical-align: baseline; color: rgb(34, 34, 34); font-family: Verdana, Arial, sans-serif; line-height: 14px; "">Thanks Popup</div>",TRUE,2,1,1,2,1
"dartiss","2022-10-29T09:51:07.133Z","A freebie from Legoland but not worth buying","<p>Received this set in a paper bag from Legoland Windsor as part of their Halloween themed Monster Street.</p>

<p>It was free, and probably best as there&#39;s really not much to it. No instructions but worked it out from images online.</p>
",TRUE,3,3,3,3,3
