"author","datePosted","title","review","HTML","overall","parts","buildingExperience","playability","valueForMoney"
"Lucem","2010-12-13T20:04:56.337Z","Hasn't been released yet","So, this set hasn't been released yet, so I'm gonna do a blind review. As in, I'm going to review this set based off of pictures I've seen. Also, I just randomly rated this thing. XD<br><br>First off, the pieces. The fists are new, and they have been molded so that they have 4 fingers, and the inside isn't filled in. Yay! Now, the body. It looks pretty interesting. While it's skinny, the waist is connected to the body (just like with the original heroes), a feature we never saw with Bionicles. The head is new, and it looks pretty interesting (also). The helmet is 2 pieces, but I'm not really fond of the the little helmet accessory. Also, the weapon has LEGO pieces on them which kinda gives it a LEGO feel. Also, he comes with light blue spears that are flexible! Also, he comes with a new hero core, which is the top half of the original hero cores. Sadly, it is made with solid plastic. It is no longer translucent.<br><br>Joints. These guys are a big improvement to the original heroes (joint wise). The legs, and arms can move! At the first sight of the 2.0 series poster on the LEGO January calender, I thought that the arms on all the heroes were the arms/legs from the original heroes, just with fancy armor.<br><br>Pros:<br><br>- JOINTS! YES!<br><br>- Nice armor<br><br>- Cool new pieces<br><br>Cons:<br><br>- Helmet accessories<br><br>- New hero cores<br><br>- Hasn't come out yet. Don't let us starve LEGO!<br><br>",TRUE,5,5,5,5,5
"Kalhiki","2010-12-26T09:10:06.573Z","I'm going to go with the cliche ""Awesome Set""","Got this for Christmas, and I'm loving it. Where should I start? <br>(if you don't want to read the whole review, skip to the overall where I sum everything up)<br><br>BUILDING EXPERIENCE: If you're new to Hero Factory and the 2011 sets are your first figures, it won't be anything new. But if you were a Bionicle fan or liked the 2010 Heroes, the building is completely different. It's basically all ball joints and rods (like the kind you can put in minifig hands).As a matter of fact, there are only three connections that are Technic (2 axles, one pin). But overall, the building experience was quite fun.<br><br>PARTS: All... Well, most... of the parts are new molds.The only reused parts are the orange bulb on his helmet, the tube, and the spears (which could be new. I don't know if they've been rubbery before).As for interesting pieces, you have the armor, limbs, helmet, hand (which has four fingers and a thumb), the weapon, and the tube, which is transparent with blue inside it. It's kinda like Meltdown's tubes only instead of green, it's blue. I'm not going to get into detail, I'll leave it a surprise for you.<br><br>PLAYABILITY: Playability is much better than last year's Heroes, and all small sets for that matter. Stormer (and the other Heroes) has knees and elbows. This way you can get him into some excellent poses.<br><br>COMPLAINTS: I have few complaints about this set, and the ones I do are very minor. First of all, he only has one hand. The other arm has his weapon. Second, the body armor kinda wobbles, but that's not too bad. Finally, his feet are big. From some poses, they don't look as big, and they look smaller in person, but they're still there.<br><br>OVERALL: I highly recommend him. The building was fun and new, the parts are great and are all new molds, he has elbow and knee joints, and my few complaints are very minor. Plus, eight bucks is a steal for what you get: an awesome, well articulated figure. If you see him in the store, definitely pick him up.<br>",TRUE,5,5,4,5,5
"kaboomlegoman","2011-01-17T16:17:51.583Z","My First Picture Review","<p>Hello Peoplez. This is my first picture review, so bear with me if they're blurry or anything. Without further ado, I present to you a review of Stormer 2.0</p>
<h4>Box/Instructions</h4><div>It has a cool pose of Stormer 2.0, in the background there is Jetbug flying out if a tube and explosions everywhere. Also there is an ad for the web code on the inside of the lid. No, I am not going to tell it to you. :)</div><div><span><span>[img]http://lh4.ggpht.com/_9bjLkQ-cLR4/TTSKoVGCmOI/AAAAAAAAAB4/iNOY7Kof8vU/DSCN0409.JPG[/img]</span></span><br></div><div><span><span>Okay, the age reads 6-16 and it has 31 pieces. A (blurry) shot of the back:</span></span></div><div><span><span><span><span>[img]http://lh3.ggpht.com/_9bjLkQ-cLR4/TTSKoRrtaLI/AAAAAAAAACA/nTxn56eEQbE/DSCN0416.JPG[/img]</span></span><br></span></span></div><div><span><span><span><span>A combination model, a real-size hero core, and all that information nobody reads. Anyway, I do like the original heroes' backs better, because they have a fight scene. Anyway, the instructions:</span></span></span></span></div><div><span><span><span><span><span><span>[img]http://lh4.ggpht.com/_9bjLkQ-cLR4/TTSKogf9IbI/AAAAAAAAACM/cN0VoF9wfR8/DSCN0420.JPG[/img]</span></span><br></span></span></span></span></div><div><span><span>A detail I didn't notice on the box, a bit of it is taken up by a Makuhero City picture. That's messed up. :S. A random page:</span></span></div><div><span><span><span><span>[img]http://lh6.ggpht.com/_9bjLkQ-cLR4/TTSKo55CldI/AAAAAAAAACU/9ZAcrMhegsI/DSCN0422.JPG[/img]</span></span><br></span></span></div><div><span><span><span><span>It's where you start building the weapon. Anyway, I have covered the box and instructions, so I go to the parts.</span></span></span></span></div>
<h4>Parts</h4><div>Okay, I'll start off with a shot of all of them.</div><div><span><span>[img]http://lh4.ggpht.com/_9bjLkQ-cLR4/TTSKpI-rvOI/AAAAAAAAACc/Oa3NhHgDprc/DSCN0417.JPG[/img]</span></span><br></div><div><span><span>Those blue parts are not sand blue by the way, they're medium blue.</span></span></div><div><span><span><span><span>[img]http://lh5.ggpht.com/_9bjLkQ-cLR4/TTSD80XNe9I/AAAAAAAAABQ/Wy_6ufn76v8/s640/DSCN0423.JPG[/img]</span></span><br></span></span></div><div><span><span><span><span>Those are all the new or recolored pieces. That tube is amazing, as is the nameplate and everything else. What's that, you say? Oh. There are only two not new or recolored pieces, which you can identify yourself in the all the pieces shot.</span></span></span></span></div><div><span><span><span><span><span><span>[img]http://lh6.ggpht.com/_9bjLkQ-cLR4/TTSD88eysOI/AAAAAAAAACo/UkNjhC2whL8/DSCN0425.JPG[/img]</span></span><br></span></span></span></span></div><div><span><span><span><span><span><span>Those are the new joints and the new body, Let me just tell you it is HARD to identify them. &nbsp;Okay, next.</span></span></span></span></span></span></div><div><span><span><span><span><span><span>&nbsp;<span><span>[img]http://lh3.ggpht.com/_9bjLkQ-cLR4/TTSWCTGlUHI/AAAAAAAAADI/RIHzX_lYLus/DSCN0432.JPG[/img]</span></span></span></span></span></span></span></span></div><div><span><span><span><span><span><span><span><span>I show off the AMAZING nameplate. It's so beautiful it gets a picture all to its own.</span></span></span></span></span></span></span></span></div><div><span><span><span><span><span><span><span><span><span><span>[img]http://lh6.ggpht.com/_9bjLkQ-cLR4/TTSWClfrdhI/AAAAAAAAADU/KavYzP7cuTQ/DSCN0435.JPG[/img]</span></span><br></span></span></span></span></span></span></span></span></div><div><span><span><span><span><span><span><span><span><span><span>As is the new head. It looks less Iron-Man-y and looks more blocky. I know this is a bad shot, I'm sorry if you can't see it.</span></span></span></span></span></span></span></span></span></span></div><div><span><span><span><span><span><span><span><span><span><span><span><span>[img]http://lh6.ggpht.com/_9bjLkQ-cLR4/TTSWCn8v0JI/AAAAAAAAADg/cUIcWBkyOC0/DSCN0436.JPG[/img]</span></span><br></span></span></span></span></span></span></span></span></span></span></div><div><span><span><span><span><span><span><span><span><span><span><span><span>The new spear sucks. Its even softer rubber than that original mold for the Atlantis tridents. As you can see here, it's very bendable.</span></span></span></span></span></span></span></span></span></span></span></span></div><div><span><span><span><span><span><span><span><span><span><span><span><span><span><span>[img]http://lh5.ggpht.com/_9bjLkQ-cLR4/TTSWC5P1_CI/AAAAAAAAADs/E5Mj_Yzplj0/DSCN0437.JPG[/img]</span></span><br></span></span></span></span></span></span></span></span></span></span></span></span></div><div><span><span><span><span><span><span><span><span><span><span><span><span><span><span>And the other new parts. From left to right are: hero core holder, main chest armor, new claw, new foot-like piece, helmet piece, hero core, and at the top that awesome tube. I will now advance to the build.</span></span></span></span></span></span></span></span></span></span></span></span></span></span></div><div><span class=""Apple-style-span"" style=""line-height: 18px; font-size: 14px; color: rgb(173, 24, 8); font-weight: bold; ""><br></span></div><div><span class=""Apple-style-span"" style=""line-height: 18px; font-size: 14px; color: rgb(173, 24, 8); font-weight: bold; "">Minifigures</span></div><div>Errr...</div>
<h4>The build</h4><div><span><span>[img]http://lh5.ggpht.com/_9bjLkQ-cLR4/TTSWC561GFI/AAAAAAAAAD4/LJVZe2rmKL0/DSCN0440.JPG[/img]</span></span><br></div><div><span><span>This is step 2 of this model. I will advance to step 4:</span></span></div><div><span><span><span><span>[img]http://lh3.ggpht.com/_9bjLkQ-cLR4/TTSb8oLQkdI/AAAAAAAAAEc/yMnVrUvGlew/DSCN0445.JPG[/img]</span></span><br></span></span></div><div><span><span><span><span>And before I put the armor on, I want to show you the very interesting way to connect the armor to the joint.</span></span></span></span></div><div><span><span><span><span><span><span>[img]http://lh3.ggpht.com/_9bjLkQ-cLR4/TTSb82pbvHI/AAAAAAAAAEo/BbYQ5FvfNgg/DSCN0449.JPG[/img]</span></span><br></span></span></span></span></div><div><span><span><span><span><span><span>That ball connects to that holder in the armor.</span></span></span></span></span></span></div><div><span><span><span><span><span><span><span><span>[img]http://lh3.ggpht.com/_9bjLkQ-cLR4/TTSb9KnCtuI/AAAAAAAAAE0/oJl1wEUbK70/DSCN0451.JPG[/img]</span></span><br></span></span></span></span></span></span></div><div><span><span><span><span><span><span><span><span>On step 4, we have the legs complete and the arms starting to take shape.</span></span></span></span></span></span></span></span></div><div><span><span><span><span><span><span><span><span><span><span>[img]http://lh3.ggpht.com/_9bjLkQ-cLR4/TTSb9AiCa7I/AAAAAAAAAE8/jQyFIUMMNcw/DSCN0457.JPG[/img]</span></span><br></span></span></span></span></span></span></span></span></div><div><span><span><span><span><span><span><span><span><span><span>That is the weapon, which has his hand conneted to it already.</span></span></span></span></span></span></span></span></span></span></div><div><span><span><span><span><span><span><span><span><span><span><span><span>[img]http://lh3.ggpht.com/_9bjLkQ-cLR4/TTSb9RddrkI/AAAAAAAAAFE/Ff9ygryfeM0/DSCN0460.JPG[/img]</span></span><br></span></span></span></span></span></span></span></span></span></span></div><div>Step 6. (The weapon and chest armor are submodels.) Now he is complete except for the head and the tube.</div><div><span><span>[img]http://lh3.ggpht.com/_9bjLkQ-cLR4/TTSgBFx-deI/AAAAAAAAAFo/ZPG6WA8cbtU/DSCN0461.JPG[/img]</span></span><br></div><div><span><span>The headgear. See those bars? They come into a very handy technique for the head.&nbsp;</span></span></div><div><span><span><span><span>[img]http://lh6.ggpht.com/_9bjLkQ-cLR4/TTSgBbuglqI/AAAAAAAAAF0/F_uyYN8QLQs/DSCN0463.JPG[/img]</span></span><br></span></span></div><div><span><span><span><span>That's the bottom of the helmet. The headgear connects to the helmet.</span></span></span></span></div><div><span><span><span><span><span><span>[img]http://lh6.ggpht.com/_9bjLkQ-cLR4/TTSgBRVYDiI/AAAAAAAAAF8/vtni4P-zTAs/DSCN0465.JPG[/img]</span></span><br></span></span></span></span></div><div><span><span><span><span><span><span>There he is nearly complete. I forgot to take a shot of the top of the head, but that has holes in it too and the headgear has pegs at the bottom too, so it can connect to that.</span></span></span></span></span></span></div><div><span><span><span><span><span><span><span><span>[img]http://lh6.ggpht.com/_9bjLkQ-cLR4/TTSgBsBzYCI/AAAAAAAAAGI/2uih_D5S-rY/DSCN0466.JPG[/img] Here he is standing up, still not complete. Oh wait, I forgot something to show you:</span></span><br></span></span></span></span></span></span></div><div><span><span><span><span><span><span><span><span><span><span>[img]http://lh5.ggpht.com/_9bjLkQ-cLR4/TTSn-jIGA6I/AAAAAAAAAIs/FDwQ1kcZwVU/DSCN0479.JPG[/img]</span></span><br></span></span></span></span></span></span></span></span></div><div><span><span><span><span><span><span><span><span><span><span>See that ball near his waist? See something cool:</span></span></span></span></span></span></span></span></span></span></div><div><span><span><span><span><span><span><span><span><span><span><span><span>[img]http://lh4.ggpht.com/_9bjLkQ-cLR4/TTSn-j2ZlDI/AAAAAAAAAI0/RRx2aSPuFtw/DSCN0482.JPG[/img]</span></span><br></span></span></span></span></span></span></span></span></span></span></div><div><span><span><span><span><span><span><span><span><span><span><span><span>That ball connecter connects to it for the desired effect. Something else:</span></span></span></span></span></span></span></span></span></span></span></span></div><div><span><span><span><span><span><span><span><span><span><span><span><span><span><span>[img]http://lh3.ggpht.com/_9bjLkQ-cLR4/TTSpQnIU7NI/AAAAAAAAAJI/fg7ZGtebVWY/DSCN0485.JPG[/img]</span></span><br></span></span></span></span></span></span></span></span></span></span></span></span></div><div><span><span><span><span><span><span><span><span><span><span><span><span><span><span>That's how you connect them.</span></span></span></span></span></span></span></span></span></span></span></span></span></span></div><div><span><span><span><span><span><span><span><span><span><span><span><span><br></span></span></span></span></span></span></span></span></span></span></span></span></div><div><span><span><span><span><span><span><span><span><br></span></span></span></span></span></span></span></span></div>
<h4>Completed Model</h4><div><span><span>[img]http://lh4.ggpht.com/_9bjLkQ-cLR4/TTSgB8vczDI/AAAAAAAAAGQ/AM1E74wOOkk/DSCN0467.JPG[/img]</span></span><br></div><div><span><span>The light of the window shines on him, and...</span></span></div><div><span><span><span><span>[img]http://lh4.ggpht.com/_9bjLkQ-cLR4/TTSjtFDzEPI/AAAAAAAAAGw/JxI3OFcE_Dk/DSCN0468.JPG[/img]</span></span><br></span></span></div><div><span><span><span><span>He is complete!</span></span></span></span></div><div><span><span><span><span><span><span>[img]http://lh6.ggpht.com/_9bjLkQ-cLR4/TTSjtUAkUmI/AAAAAAAAAG4/9nt8odmxs0c/DSCN0470.JPG[/img]</span></span><br></span></span></span></span></div><div><span><span><span><span><span><span>Here he is with his canister.</span></span></span></span></span></span></div><div><span><span><span><span><span><span><span><span>[img]http://lh4.ggpht.com/_9bjLkQ-cLR4/TTSjtpi1S_I/AAAAAAAAAHI/WgJng4GzEsc/DSCN0471.JPG[/img]</span></span><br></span></span></span></span></span></span></div><div><span><span><span><span><span><span><span><span>Here is a shot from the back, better showing how the tube is connected, the armor is connected, and the Makuhero City party of the canister.</span></span></span></span></span></span></span></span></div><div><span><span><span><span><span><span><span><span><span><span>[img]http://lh4.ggpht.com/_9bjLkQ-cLR4/TTSjtjO5cAI/AAAAAAAAAHQ/FeHchdDQB44/DSCN0477.JPG[/img]</span></span><br></span></span></span></span></span></span></span></span></div><div><span><span><span><span><span><span><span><span><span><span>Here's a shot that simply shows his two hands aren't the same. One thing I forgot to tell you, That fist hand is new; it has four fingers.</span></span></span></span></span></span></span></span></span></span></div><div><span><span><span><span><span><span><span><span><span><span><span><span>[img]http://lh6.ggpht.com/_9bjLkQ-cLR4/TTSjtyL6cWI/AAAAAAAAAHc/bIE_0fPMhwg/DSCN0475.JPG[/img]</span></span><br></span></span></span></span></span></span></span></span></span></span></div><div><span><span><span><span><span><span><span><span><span><span><span><span>This is showing the new knees that LEGO finally decided to put in.</span></span></span></span></span></span></span></span></span></span></span></span></div><div><span><span><span><span><span><span><span><span><span><span><span><span><span><span>[img]http://lh5.ggpht.com/_9bjLkQ-cLR4/TTSn-JiQt_I/AAAAAAAAAH8/XrHjRNr41og/DSCN0476.JPG[/img]</span></span><br></span></span></span></span></span></span></span></span></span></span></span></span></div><div><span><span><span><span><span><span><span><span><span><span><span><span><span><span>And elbows, too! Yay!</span></span></span></span></span></span></span></span></span></span></span></span></span></span></div><div><span><span><span><span><span><span><span><span><span><span><span><span><span><span><span><span>[img]http://lh4.ggpht.com/_9bjLkQ-cLR4/TTSn-Y0iieI/AAAAAAAAAIk/PJdaaPiCLiw/DSCN0478.JPG[/img]</span></span><br></span></span></span></span></span></span></span></span></span></span></span></span></span></span></div><div><span><span><span><span><span><span><span><span><span><span><span><span><span><span><span><span>The suckiness of the spears can be shown nowhere closer than this. Need I say more?</span></span></span></span></span></span></span></span></span></span></span></span></span></span></span></span></div><div><span><span><span><span><span><span><span><span><span><span><span><span><span><span><span><span><span><span>[img]http://lh4.ggpht.com/_9bjLkQ-cLR4/TTSpQWGiV4I/AAAAAAAAAI8/VUuji8R5S6M/DSCN0473.JPG[/img]</span></span><br></span></span></span></span></span></span></span></span></span></span></span></span></span></span></span></span></div><div><span><span><span><span><span><span><span><span><span><span><span><span><span><span><span><span><span><span>A cool shot from the left, showing the nameplate and that bulb on the headgear.</span></span></span></span></span></span></span></span></span></span></span></span></span></span></span></span></span></span></div><div><br></div><div><span><span><span><span><span><span><span><span><span><span><span><span><span><span><span><span><span><span><br></span></span></span></span></span></span></span></span></span></span></span></span></span></span></span></span></span></span></div><div><span><span><span><span><span><span><br></span></span></span></span></span></span></div>
<h4>Summary</h4><div>No pictures here, just the summary.</div><div><br></div><div>Building experience: 8/10. It's fun enough, but I feel that weird desire like with Indiana Jones sets. If it was bigger, or Fire Lord was made like this but with lots of add-ons, it would be much funner.</div><div><br></div><div>Parts: 10/10 All of them are beautiful. Amazing.</div><div><br></div><div>Playability: 8/10 I only have Nex 2.0, Breez 2.0, and Stormer 2.0, but with baddies, it's funner. (I speak as someone that has all the 2010 Hero Factory sets.)</div><div><br></div><div>Value for Money: 7/10 It's the same as the old heroes, who only have 17 and 19 pieces, but these have around 30, and they're the same price. Amazing. But still, The prices for all Bionicle/ Hero Factory are bad.</div><div><br></div><div>Design: 8/10 I like the design for the armor attaching, and I don't like the helmet falling off all the time, but it evens out in the end.</div><div><br></div><div>Action Figures: 10/10 (That section is usually minifigures but this doesn't have any.) I like him overall.</div><div><br></div><div>Overall: 51/60 It made it to the 50 mark, and that's really good. I hope this was helpful, because I spent all day working on it.</div>",TRUE,5,5,4,4,5
"NickBrick","2011-02-26T21:13:14.827Z","A breakthrogh in design and some new parts make this set pretty intresting.","When I first saw the pictures of the 2.0 Heroes I just about threw up. they had strange weapons, blocky parts, and from the looks of em...no transparent parts! And when I bought the set thats just what I got. But hear me out, for I got a surprise.&nbsp; I had been hearing about <br>some sort of modification on the old Inika build and decided&nbsp; that I'd pick up Stormer 2.0<br>The new build is actually quite good! and almost double the pieces? Man! Lego is finally listening to our pleas to up the piece counts! WEAPONS: Like I said above, weird. Its a combination of Breez 2.0's and Evo 2.0's weapons except in different colors. Oh yeah, and the spears are rubber too. However, we do get a very interesting new hook piece. With all sorts of sharp edges and even some holes for expansion the weapons get an overall score of 3.8<br>ARMOR AND HELMET: Blocky. Very blocky. This is the worst part of the set. while fun to snap on it looks like someone just took a bunch of building blocks and put them on a stick figure. Thankfully a new printed armor peice is included and is great for giving MOCs&nbsp;&nbsp;&nbsp;&nbsp;&nbsp;&nbsp;&nbsp; personality The helmet is small but the section covering the eye&nbsp; makes him look really good. overall score: 3.9<br>POSEABILITY AND OVERALL SCORE: The 2.0s are much better when is comes to making interesting poses. You can make do all sorts of stuff. Much much better that the old heroes.<br>For $7.99 Stormer 2.0 is worth the money. He is good for a first 2.0 hero. however I like Evo 2.0 better. Final score: 4.2 Hope I was helpful. Ill be reviewing Evo 2.0 and Von Nebula soon.<br><br>",TRUE,4,3,3,4,4
"HeroFactoryDude316","2010-12-30T17:12:08.393Z","Ice Blast 2.0","I got Stormer 2.0 at TRU a few days ago. He is one of the best Lego's I have ever gotten. First he comes with twice as many pieces as the first. Another thing is that his weapon is awesome and the build of the head is very cool.<br><br><ul><li>Pros:</li><li>Good amount of pieces</li><li>Awesome blue spears</li><li>Snap on armor <br></li><li>A blue hero core</li><li>Goggle visor whatever it is piece</li></ul><ul><li>Exclusive STORMER 2.0 armor piece</li><li>Cons: None</li></ul>Overall this a fantastic set and I would recommend it to any Hero Factory collector.5/5<br><br>",TRUE,5,5,5,5,5
"QuickBricks","2011-03-07T09:35:54.647Z","An Unexpected Surprise...","I bought this set yesterday and was very pleasantly surprised! I thought that it would stink because it looks nothing like the original Preston Stormer. I bought him anyway, however, because Stormer is my favorite hero and I had to stay up to date, right? Well, my disillusion was quickly dissipated as soon as I had opened up the canister. I must say that it is pretty impressive. The tube that extends from Stormer's back to his weapon is transparent, except for a blue streak that runs down the middle of it. His head and Hero Core are solid blue, and the printed piece that says ""Stormer 2.0"" on the top of the left arm is pretty cool as well. The light at the top of his headgear is transparent orange, and the GPS and thermal indicators that are mentioned on the sight are not there, the eyepiece just has some markings on it that would indicate such devices. One more thing about the pieces that needs to be mentioned is that the spears on his weapon are rubbery. The flexibility on this hero is excellent as well, and it allows a whole lot more poseablility to Stormer. Lastly, the code in the top of the canister grants you access to play the new game ""Creep Crushers"" as Stormer on www.herofactory.lego.com. Overall, a great set. Don't let the appearance on the canister deter you from buying this awesome hero!<br>",TRUE,5,5,4,4,4
"KLOKRIECHER","2012-01-12T10:05:03.54Z","LEGO HERO Factory - Stormer 2.0 Review","This figure is a very cool figure to have and it's fun to play with as well. The build is very nice and easy and we also don't have to worry about stickers. The legs, the feet, the arms, the hands and the head can be moved and one arm has a nice looking shield with two blue spears which are rubbery for some reason. As I told you in the beginning: It's a very cool figure to have - even for pieces which you can use for future MOC's (My own creations) and/or brickfilms for sure.<br><br>All
in all this set is an great set and I would HIGHLY recommend you to get
this. You can find this set on eBay, BrickLink and Amazon for sure.
Here is the link where you can check out the full gallery I made for this set
on my website: <a href=""http://www.klokriecher.de/home.php?id=202020040004"">http://www.klokriecher.de<br></a> <br><br><span style=""font-weight: bold;"">Videos I made of this set:</span><br><br><a href=""http://www.youtube.com/user/KLOKRIECHER#p/search/1/e7Fz92PM6uM"">Stopmotion</a><br>
<a href=""http://www.youtube.com/user/KLOKRIECHER#p/search/0/1eMqSPtOxC4"">Review</a><br>",TRUE,4,2,3,4,4
"VBaskin2010","2011-04-14T13:34:37.3Z","Preston Is Back!","<strong><em>One Of The Mightest Members Of The Hero Factory Is Now Bigger And Iceier Than Ever Preston Stormer Along His 3 New Members Of Team Alpha Got A Brand Armor And A Brand New Weapon, But The One Thing That Never Changes Is That His Wisdom Is There And Always Will Be.</em></strong>",FALSE,5,5,5,5,5
"KodakKid365","2011-03-12T09:08:39.457Z","Very nice set.","Stormer's head is cool, and the weapon is as well. The only problem with the weapon is that it only has one blade, and it's a lot better with two. The tube looks great. Another problem is that his normal arm is to short. Stormer is the tallest hero. I totally recommend him to you. he could lead the Alpha team in to battle against the Fire Lord any day.",FALSE,4,4,4,4,4
