"author","datePosted","title","review","HTML","overall","parts","buildingExperience","playability","valueForMoney"
"CapnRex101","2012-08-28T14:16:36.53Z","9498 - Saesee Tiin's Jedi Starfighter","<p><span style=""font-size: 11px; line-height: 14px; "">As one of the sets I anticipated least eagerly of this fantastic selection of summer Star Wars sets, set 9498, Saesee Tiin’s Jedi Starfighter, has really surprised me as the vehicle is a huge step up from previous Delta-7 Aethersprite Starfighter models which is just about as good as you are going to get an Minifigure scale in my opinion. The Minifigures however were the real draw and neither of them disappoint, if you have read my T-6 Jedi Shuttle review from last year you may remember how much I adore the Saesee Tiin Minifigure, and the brand new Even Piell is also an excellent figure. Even the Astromech Droid is impressive with a surprisingly attractive colour scheme!</span>
</p>
<h4>Box/Instructions</h4><p></p><p style=""margin-top: 12px; margin-bottom: 12px; border: 0px; outline: 0px; font-size: 11px; vertical-align: baseline; line-height: 14px; "">The box artwork for this set is just as vibrant as one would hope, prominently featuring the Starfighter in action with laser blasts flying all around the ship. One of the flick fire missiles has been launched and Saesee Tiin is visible piloting his ship with R3-D5 placed just in front of him to assist with navigation.&nbsp;As always along the right side of the cover is a gallery of the three Minifigures on a blue background and along the top is the standard shot of Darth Maul in action (a great image in my opinion) with the Lego Star Wars logo towards the left hand side of the box.</p><p style=""margin-top: 12px; margin-bottom: 12px; border: 0px; outline: 0px; font-size: 11px; vertical-align: baseline; line-height: 14px; ""></p><p style=""margin-top: 12px; margin-bottom: 12px; border: 0px; outline: 0px; vertical-align: baseline; "">On the reverse of the box is a picture of the Starfighter landed with Saesee Tiin exiting the vehicle while Even Piell stands in the foreground. Surrounding this large image are many smaller pictures demonstrating the features, including the retractable landing gear, opening cockpit, removable cockpit section, and flick fire missiles.&nbsp;There are a couple more shots of the ship flying through space with the Malevolence (set 9515) shooting at it, and Saesee Tiin flying away from his damaged ship in the small escape pod. Beneath those are the blueprint style images which I am a big fan of on all of the Star Wars boxes this year.</p><p style=""margin-top: 12px; margin-bottom: 12px; border: 0px; outline: 0px; vertical-align: baseline; ""></p><p style=""margin-top: 12px; margin-bottom: 12px; border: 0px; outline: 0px; vertical-align: baseline; "">There are two instruction manuals, which is a bit odd considering the size of the set and both feature the same artwork as the box on their covers.&nbsp;The second of these has a nice comic strip at the end which features the Malevolence attacking this Jedi Starfighter and I was not able to find any mistakes, nor did my set have any missing pieces.</p><p></p><p></p><p></p>
<h4>Parts</h4><p></p><p style=""margin-top: 12px; margin-bottom: 12px; border: 0px; outline: 0px; font-size: 11px; vertical-align: baseline; line-height: 14px; "">The most obviously attractive thing about this set from a parts perspective is the swathes of dark green which make up a significant portion of the vehicle. You get several plates and curved wedge pieces in this colour which could prove useful as it certainly broadens the number of colours available for you own creations.&nbsp;There are few golden pieces too which are nice and two of the darker green lightsaber blades which I think are an improvement over the older shade of green. The piece which forms Saesee Tiin’s horns is very nice as is the part for Even Piell’s ears and ponytail. Not a bad selection overall, but of course the real highlight is all of that dark green!</p><p></p>
<h4>Minifigures</h4><p></p><p style=""margin-top: 12px; margin-bottom: 12px; border: 0px; outline: 0px; font-size: 11px; vertical-align: baseline; line-height: 14px; "">All three&nbsp;minifigs are fantastic, the two Jedi are both really outstanding:&nbsp; among the best&nbsp;Jedi produced by LEGO, and the Astromech Droid too, as I mentioned earlier, is great as well. I will begin with the two Jedi.</p><p style=""margin-top: 12px; margin-bottom: 12px; border: 0px; outline: 0px; font-size: 11px; vertical-align: baseline; line-height: 14px; "">The first of these is the brand new&nbsp;<strong style=""margin: 0px; padding: 0px; border: 0px; outline: 0px; vertical-align: baseline; background-color: transparent; "">Even Piell&nbsp;</strong>who,&nbsp;for many people this will be the biggest draw to this set and those people will not be disappointed! The brand new moulded piece which forms the top of Even Piell’s head is great, made of a rubbery plastic as I expected, it is hugely detailed and very accurate to his appearance in the Clone Wars television show. It is cast in a flesh colour and is printed with a few scars and his brown ponytail. The clasp holding his ponytail together is extremely detailed with a tiny decorative design just as it is in the show which is an extraordinary detail.</p><p style=""margin-top: 12px; margin-bottom: 12px; border: 0px; outline: 0px; font-size: 11px; vertical-align: baseline; line-height: 14px; "">The large ears of his Lannik species are present, along with a few wrinkles in his skin on this part. However I have heard of a few people finding an issue involving this piece sitting a little too far down on the head of the Minifig which obscures the eyes printed on the head piece, although my own figure does not suffer from this problem and his head looks absolutely fine.&nbsp;His head piece is printed with a very serious expression, lots of wrinkles and his eyes, one of which has a large scar running across it and is closed. Over his eyes are two brown eyebrows which are obscured by the ears piece.&nbsp;The piece is predominantly flesh in colour, the same as the rubbery top of his head. There is no printing on the back of the head as one might expect.</p><p style=""margin-top: 12px; margin-bottom: 12px; border: 0px; outline: 0px; font-size: 11px; vertical-align: baseline; line-height: 14px; "">The torso is printed with dark brown Jedi robes and a black undershirt, which are held together towards the bottom the torso by a nice belt which has a couple of pouches on it. On the back of this part the robes are continued with the remainder of the belt and a few creases. His arms are dark brown like the rest of his robes with standard flesh hands. He has short black legs as, being a Lannik; the stature of Even Piell is similar to that of Yoda in the television show. They are not printed and are unposeable as usual. He carries a lightsaber with a metallic silver hilt, and a nice green blade. Overall a very nice Minifigure, but if the issue involving his head pieces not lining up is widespread,&nbsp;that could be a bit off putting and certainly worth a call to LEGO if your figure has this problem.</p><p style=""margin-top: 12px; margin-bottom: 12px; border: 0px; outline: 0px; font-size: 11px; vertical-align: baseline; line-height: 14px; ""></p><p style=""margin-top: 12px; margin-bottom: 12px; border: 0px; outline: 0px; vertical-align: baseline; ""><strong style=""margin: 0px; padding: 0px; border: 0px; outline: 0px; vertical-align: baseline; background-color: transparent; "">Saesee Tiin</strong>&nbsp;is a fantastic figure and I am delighted that he has been included once again in a set, even if the figures are completely identical. The piece which forms his horns is superb, made of a hard plastic and cast in a flesh colour, it is printed all over with huge amounts of detail including a large dark orange area on the top of his head and some small dark orange blotches around the crown of his head.</p><p style=""margin-top: 12px; margin-bottom: 12px; border: 0px; outline: 0px; vertical-align: baseline; "">There are a few little wrinkles and scars, as well as Master Tiin’s two large horns with are dark tan in colour. Running down the back of his head is a dark grey design which is accurate to his appearance in the television show. His head is similar to that of Even Piell featuring a serious expression and some wrinkly skin all printed on a flesh coloured head. His eyes are very wide and yellow, again just like in the Clone Wars television programme. There is no printing on the back of his head and the eyes line up nicely with the horn component.</p><p style=""margin-top: 12px; margin-bottom: 12px; border: 0px; outline: 0px; vertical-align: baseline; "">The dark brown torso is printed with creased Jedi robes which are very much like those of Even Piell, but the undershirt is dark grey and his belt is light brown unlike Master Piell’s. There is more of the belt and his layered Jedi robes printed on the reverse side of the torso which is excellent. His arms are white like in the films and the television show, and his gloved hands are black. His legs are plain dark brown with no printing and he carries a green lightsaber identical to Even Piell’s. This is an exact copy of the previous Saesee Tiin, but it is such an outstanding figure that this does not concern me.</p><p style=""margin-top: 12px; margin-bottom: 12px; border: 0px; outline: 0px; vertical-align: baseline; ""></p><p style=""margin-top: 12px; margin-bottom: 12px; border: 0px; outline: 0px; vertical-align: baseline; "">The Astromech Droid assigned to Saesee Tiin, <b>R3-D5</b>, is the weakest figure of the set in my opinion, but is still superb nevertheless! His domed head is metallic silver with plenty of green panels and of course various small details such as buttons and dials. As with every Astromech, there is a stud on top of the head making it possible to attach something if you so wish.</p><p style=""margin-top: 12px; margin-bottom: 12px; border: 0px; outline: 0px; vertical-align: baseline; "">The cylindrical body of the Droid is green but has some white highlights on a few panels on the front, but nothing on the back as usual; his legs are plain green with no printing at all. The colour scheme of this figure makes it very eye catching and unique, for a simple Astromech Droid, this is a lovely figure all in all, and is certainly one of my favourite Astromech Droids of all time!</p><p></p><p></p><p></p>
<h4>The build</h4><p></p><p style=""margin-top: 12px; margin-bottom: 12px; border: 0px; outline: 0px; font-size: 11px; vertical-align: baseline; line-height: 14px; "">The&nbsp;ship is built in four sections. It is totally modular in that the individual sections are connected by pins or&nbsp;click-hinges and can be disassembled&nbsp;if needed.&nbsp;The first section, in bag one,&nbsp;is the cockpit. It&nbsp;utilises&nbsp;SNOT techniques to form the curved sides. The two pins at the front are used to connect it to&nbsp;the rest of the ship's body.&nbsp;The cockpit is hinged at the front, and is&nbsp;quite roomy inside with plenty of space to seat your pilot comfortably. The second bag&nbsp;contains parts for the&nbsp;fuselage.&nbsp;The cockpit assembly slides&nbsp;on the tiles at the back and mates&nbsp;with the 1x2 Technic&nbsp;brick&nbsp;by the gold curved pieces. Finally, the wings are constructed in bags&nbsp;three and four, they connect to the&nbsp;fuselage by four click hinges on each side.</p><p style=""margin-top: 12px; margin-bottom: 12px; border: 0px; outline: 0px; font-size: 11px; vertical-align: baseline; line-height: 14px; "">This build phase is rather entertaining and only takes about half an hour, but still utilises some good SNOT techniques and a clever design for the tail fin which makes the model very sturdy indeed. There is a very minimal amount of Technic, which for me is a positive as while I like builds to remain dynamic and different, I much prefer Lego System construction in general.</p><p></p>
<h4>The completed model</h4><p></p><p style=""margin-top: 12px; margin-bottom: 12px; border: 0px; outline: 0px; font-size: 11px; vertical-align: baseline; line-height: 14px; "">Aesthetically the finished model is very striking, more so than any other Jedi Starfighter of this kind in my opinion. The design has been updated from previous versions and is visibly quite different to the rest, most notably around the back of the ship where the cockpit and tail fin area have been completely overhauled. The design is also much sturdier than the others which is another improvement that has been made.</p><p style=""margin-top: 12px; margin-bottom: 12px; border: 0px; outline: 0px; font-size: 11px; vertical-align: baseline; line-height: 14px; "">This ship has a fairly minor role in a single Clone Wars episode, Citadel Rescue, and it is only seen very briefly. However, from what we do see of the vehicle in the show, this model seems remarkably accurate with the patterns and colours! The dark green front of the Starfighter is similar to previous ones, using a large curved slope element with a huge sticker on the top of it, and two smaller decals on the sides to create the shape of the ship. On each wing are two flick fire missiles, which are fine underneath the wings, but are a little out of place on the top and they certainly reduce the sleek look of the ship from this angle. They are a fun feature for younger builders and can be launched a fair distance if you flick them just right so I am happy to see them included, but perhaps for display it might be worth removing them from the top which would require only minor adjustments.</p><p style=""margin-top: 12px; margin-bottom: 12px; border: 0px; outline: 0px; font-size: 11px; vertical-align: baseline; line-height: 14px; "">The Astromech Droid slots in to a hole behind these missiles and rests with his body pointing to the side, but the angle of his head can of course be changed to face the front. Next to this is a golden stripe which goes across the top of the ship and there are also a couple more stickers here to continue the pattern. The cockpit is an all new design and can be detached to form an escape pod for the pilot if things get too intense. Inside is a seat for one minifig, and a control console for the pilot to use. The sides of this cockpit are much more curved than others, and therefore more accurate to the television programme. A bubble style cockpit cover can be hinged open from the front which is nice, an improvement over the older windscreen that was used in my opinion. On the right hand wing is a Republic cog logo which is a sticker, and at the very back is a completely new design for the tail fin. It is much stronger than the old design which made use of a large flag which tended to wobble around a little bit during flight.</p><p style=""margin-top: 12px; margin-bottom: 12px; border: 0px; outline: 0px; font-size: 11px; vertical-align: baseline; line-height: 14px; "">The entire rear view of the ship has been changed dramatically, the engines are now set much lower than before and there is a section between the two engines which is filled in unlike previous models, this is accurate to the television show, and it provides some support to the vehicle to keep it more rigid and less likely to break while you are swooshing it around!</p><p></p>
<h4>Summary</h4><p><span style=""font-size: 11px; line-height: 14px; "">While I do not think this is the best model of this summer, it has surprised me and is certainly a worthy purchase. The Minifigures are outstanding and the Starfighter is a huge improvement over the old designs of this vehicle which is now much more swooshable. For fans of the Clone Wars this is a set I would recommend, but perhaps to be purchased after one or two of the others as this set fades in to the shadows somewhat due to the excellence of other models this summer.</span>
</p><p><span style=""font-size: 11px; line-height: 14px; ""><br></span></p><p><span style=""font-size: 11px; line-height: 14px; "">Overall - 9/10</span></p>",TRUE,5,5,5,5,5
"Namanbricks","2012-09-24T00:40:40.967Z","This Is A Great Set ","I picked this set up last week and I was really happy to get this set. Lets began. The build was good not the best not the worst it was split in 4 bags 1 for the cockpit 2 for the main part of the starfighter. And bags 3 and 4 were for the wings. The minifigs are really good Evan Piell is the main minifig of the set. He has a new rubber headpiece and short legs he also has a green lightsaber. R3-D5 is a great minifig to he has all new green parts and he is seasee tinns droid. Now saesee tinn is not new though a great jedi to have. He also hold a great lightsaber and was seen in the T6-Jedi shuttle. The starfighter is the best one that they have ever made and I hope they make more! It has 4 flick fires on the top and bottom. It also has an area to put Saesee tinns lightsaber. The droid sits in the middle of the starfighter and the ship has retractable landing gear.There is an escape pod where the cockpit is and it works great. it has 244 pieces and the set number is 9498. you should go and buy this set today right now.",FALSE,5,5,5,5,4
"DutchFlyer","2018-11-30T04:19:28.053Z","Best looking of the Jedi Starfighters?","<h2>Summary</h2>

<p>Saesee Tiin&#39;s&nbsp;is one in a fairly long line of Jedi Starfighters that has been released over the years, starting with Ashoka&#39;s&nbsp;Starfighter and Vulture Droid&nbsp;(set 7751) in 2008. Saesee Tiin&#39;s&nbsp;jedi Starfighter is one of the most striking, IMHO of those. Its build is similar to the Plo Koon&#39;s&nbsp;Starfighter&nbsp;(set 8093) and even Anakin&#39;s Custom Jedi Starfighter&nbsp;(set 75087). In the end, you have a very nice looking starfighter, with three nice minifigs, that is very swooshable. If you can still find them for about a 30 euro price, IMHO that is quite reasonable, and you should seriously consider getting this set.</p>

<h2>Build experience</h2>

<p>The most annoying part about the build was that Lego felt in necessary to divide 244 pieces into four (!) bags, for a set age 7 and up. Two bags in total would have been perfectly fine. The construction of the central spine and the cock-pit/escape pod has quite a bit in common with that of Anakin&#39;s&nbsp;Custom Jedi Starfighter. Most of the stickers in this set are also applied at this point. They are also easy to apply. One has to pay attention though, as the stickers on the sheet are NOT numbered. It is also - for most them - better to apply when the (sub-)assembly is already partially built, so they line up properly with other bricks and the rest of the structure.</p>

<p>Overall it took me 45 minutes to put the set together, without too any trouble. It was nice to see how the designers still tried to make the build different from that of other Starfighters, even though the final result is quite similar.</p>

<h2>The Minifigure</h2>

<p>There are three minifigures, Saesee&nbsp;Tiin, Even Piell, and R3-D5, the latter two being unique to this set.</p>

<p>R3-D5&#39;s print is similar to that of R2-D2. It is well done, and nicely in register. The green fits nicely with the colour scheme of the starfighter.</p>

<p>Even Piell&nbsp;has a nice torso print, and a beautiful single face print, slightly different from that of Saesee&nbsp;Tiin. His mohawk&nbsp;and ears are on a head-piece made of soft and rubbery material. As a result, it is not very solidly attached to the head, unfortunately.</p>

<p>Saesee&nbsp;Tiin&nbsp;is not unique to this set, he was also found in set 7931, T-6 Jedi Shuttle. His torso print is IMHO better than Even Piell&#39;s. There is slightly more colour, and it is just as detailed. His head is nice, and his head piece is good. The &#39;horns&#39; are of a softish rubber, but the central part is much harder plastic. As a result, it is firmly attached to the head.</p>

<h2>The build</h2>

<p>The starfighter&nbsp;itself is well-designed. Construction is smooth, and in the end there are no truly noticable and annoying gaps left. The stickers definitely add to the overall look of the fighter. I like the fact that they have thought of the little clip for Saesee&#39;s light saber. The one structural weakness are the engine pods, that come off quite easily.&nbsp;&nbsp;</p>

<h2>Play vs Display set.</h2>

<p>This set is a bit of both. It is very swooshable, the flick-fire missiles are nice, there are nice minifigures, there is nothing not to like. Similarly, the set is striking enough and big enough to work as a display piece. Especially in a line-up with some of the other Jedi Starfighters.</p>

<h2>The verdict</h2>

<p>Overall this is a good set, with very nice minifigures, that looks good, is fun to build and fun to play with. Its original RRP was good to acceptable, IMHO. If you can still find it for around that price, I would not hesitate to pick it up.&nbsp;</p>

<p>&nbsp;</p>

<p>&nbsp;</p>

<p>&nbsp;</p>

<p>&nbsp;</p>

<p>&nbsp;</p>
",TRUE,4,4,4,4,4
