"author","datePosted","title","review","HTML","overall","parts","buildingExperience","playability","valueForMoney"
"Firox_5000","2012-07-21T18:00:24.463Z","latest jedi star fighter ","This was the first 2012 summer set of the star wars series I bought this year and it's certainly a rather good set.&nbsp;<div><br></div><div>The model includes three minifugres [two if you exclude the r2 unit] the first one being saesee thin himself who comes with a green lightsaber and his detailed head piece which is a rather nice mould. Eventhough this figure is technically not new it's good to see him in another set as he isn't still a too common figure. The other main figure is Even Piell who is another jedi and unlike saesee thin is a new figure who hasn't been done before. While I don't know much about him or remember him from the films I must he admit he is a rather cool figure with a neat head piece and is a good addition to your jedi mini figure collection. The [debtable] third mini figure is a green r2 unit called R3-D5 which has been done in a rather sleek green colour which makes a difference from previous R2 droids.&nbsp;</div><div><br></div><div>The build is rather amusing but rather simplified with a four bag build as well also using two instruction manuals as well and took me around 25-30 minutes.&nbsp;</div><div><br></div><div>The finished model results in a long and rather sleek star fighter. The colour of the ship is in a beautiful emerald green colour as well as a different designed cockpit in the star fighter which is more sleeker than older models. Because of the colour scheme and new sleek cockpit design alone this is why I consider this the best designed jedi star fighter yet. The ship is also slightly bigger than older models too.&nbsp;</div><div><br></div><div>The ships playability compared to the other star fighters is more complex with the main features being the flick fire missiles and the detaching cockpit when the ship is attacked and hit.&nbsp;</div><div><br></div><div>At £30, I find myself disappointed by the price hikes as the first star fighter was £22 then the one after that which included plo koon was £26 and while this one contains another figure and is very slightly bigger is £30 which is rather a lot more being two years since the last one which makes me reckon if they're going to do another variant in say another two years time it will be £35. This set should really cost £25 and thats just at license standard value as £30 is a big call for a set of this size.&nbsp;</div><div><br></div><div>Overall despite being part of a recent trend of varied star fighters, this is a very good set with some neat design touches to it and I strongly recommend this to all star wars fans, those after a jedi army, collecting r2 variations and those who missed out on the jedi shuttle.&nbsp;</div><div><br></div><div>This is a set I strongly recommend to buy whether you own as it's the best designed star fighter yet.&nbsp;</div><div><br></div><div><br></div>",TRUE,4,5,4,5,3
"Graysmith","2012-07-24T12:56:47.417Z","The Sleekest Starfighter","<div>I was a bit surprised to find myself so enamored by this set since none of the previous Jedi Starfighters that LEGO has released interested me in the slightest. But this latest design completely blows the others out of the water, and then some. It makes those older Jedi Starfighters look clunky by comparison, even though they’re only from a few years back. Much of that I think is because of LEGOs increased willingness to use SNOT building techniques (and creating new parts just for that). Saesee Tiin’s Jedi Starfighter doesn’t use a lot of SNOT techniques, it’s mainly used for the cockpit, but it makes a world of difference compared to the older Jedi Starfighters.</div><div><br></div><div>The build itself is as such pretty straightforward and results in a very robust model. A kid could probably play very roughly with this model without it falling apart. Even the cockpit, which can separate from the ship’s body like an escape pod, doesn’t rattle or come off accidentally. Speaking of the escape pod, that’s all you’re getting as far as play features go (outside of flick-fire missiles), but it’s a nice little feature that doesn’t detract or interfere with the look of the model (unlike those ships with levers and buttons sticking out of them). I’m also impressed by how relatively large the finished model is considering the set only comes with 244 pieces.</div><div><br></div><div>While this set comes with quite a few stickers (10 in total) the ship looks just as good without them. I didn’t apply any of them when I built it, and the only one I’m thinking of applying is the large one down the front. Other than that one the stickers do very little and can safely be left off without it taking anything away from the model.</div><div><br></div><div>As for the minifigures, I will admit I’m not much of a fan of the look that LEGO uses for the Clone Wars minifigures. Most of the time they just look weird with those oversized eyes, and that look doesn’t really make sense either since they don’t really look that much more like the characters do in the animated series. That said, the Saesee Tiin and Even Piell minifigures that are included in this set are among the nicer Clone Wars minifigures as far as I’m concerned, and they are very nicely detailed. Last but not the least is my favourite minifigure of the set, the R3-D5 astromech. Even though it’s just a colour variation from other similar droids, it looks really great in green.</div><div><br></div><div><b>Bottom line</b>: I think a lot of people might be overlooking this set in favour of the more famous ships and scenes that have been released this year, and that’s a shame for such a fine little ship. I’ll proudly display this Jedi Starfighter alongside its more famous siblings; the TIE Fighter and the X-Wing.</div>",TRUE,5,5,4,4,4
"legolee329","2012-07-28T00:46:10.133Z","Best Jedi Starfighter Yet!","<span class=""Apple-tab-span"" style=""white-space:pre"">	</span>Now this was the least exciting set from the new summer wave of Star Wars sets. This set really has a terrible ""been there done that"" sort of feeling. Not saying that it is bad... but just not all that special. One good thing is that it is rather cheap. $30 makes it the second smallest in the new line and easy to afford. But that price isn't perfect. The set comes in with 244 pieces, making it around 12.3 cents per piece. It should have been $25 making it almost 10 cents per piece.&nbsp;<div><span class=""Apple-tab-span"" style=""white-space:pre"">	</span>Jedi Starfighters have seemed to be a staple in LEGO Star Wars ever since The Clone Wars movie came out. Seriously, every year since 2008 has had a new Jedi Starfighter set. This one however is a little different. It is the most pieces a single Starfighter set has had to date and the first not to use the original canopy piece introduced way back in 2002. This time around, the cockpit is covered up by the piece from the Geonosian Starfighter last year, first coming in the original wave of Atlantis sets. I prefer the old looking canopy, but like the way the new one opens and does just pop off.&nbsp;</div><div><span class=""Apple-tab-span"" style=""white-space:pre"">	</span>The figures. LEGO sets are building toys you know? Not just mini action figures with nice backdrops. It seems to be that way because like many new sets... one of the highlights in this set are the figures. Saesee Tiin is not new. He is the same design as the one from 2011's Jedi Shuttle set. But that set was $60... so now this is a much cheaper way to acquire him. A staple with each Jedi Starfighter set is coming with a new design astromech droid. This time around the droid has green legs and a green body with a silver head. His name is R3-D5. The colors really match the Starfighter well and he is one of the better droids to date. One way this set differs from all the others is the inclusion of a third figure. Jedi Master Even Piell making his debut in a LEGO set. Honestly, this character is not needed but is a nice inclusion. It does feel like LEGO just threw him in to raise the price up $5.&nbsp;</div><div><span class=""Apple-tab-span"" style=""white-space:pre"">	</span>The actual ship itself is a pretty good design... improving on some week points others had. The color scheme and pieces are just great! Dark green is pretty hard to come by and gold is always a welcome addition. The cockpit area looks a little odd and has some gaps into it... which could have easily been filled up! Lazy LEGO. The features are rather lame on this set. FOUR flick missiles two on either side top and bottom. Landing gear function, opening canopy and cockpit comes off to be an escape pod of sorts. Could have used some more ACTION features. The Starfighter isn't much bigger than others... but is a little bit taller. It has a nice weight to it and is very stable and swooshable!</div><div><span class=""Apple-tab-span"" style=""white-space:pre"">	</span>Final Verdit: This set is fun, has good colors, cool figs, pretty cheap price. Also I just like Jedi Starfighters. Complaints: gaps in cockpit, $5 overpriced, deja-vu, not too many awesome features, looks a little weird. I would recommend this set. Get the much better Desert Skiff first and save $5... but this one is still pretty good. I would rate it:</div><div>7.5/10!</div><div>Thanks for reading and check out LegoLee329 on YouTube for LEGO set video reviews!</div><div><br></div>",TRUE,4,4,4,3,3
"Odeinoichus","2014-01-02T11:28:35.913Z","Jedi Starfighter Impresses","<p><strong>Set #9498 Saesee Tiin's Jedi Starfighter: </strong>LEGO has made a lot of these Starfighter sets over the years, from 2002's AotC Jedi Starfighter for Obi-Wan up to and including this set. Honestly I haven't bought any of these sets for a long time, mostly because my collecting of LEGO has been a bit more limited than usual. So I was pleasently surprised to find that Canadian Tire of all places was selling this during the holidays in their Seasonal section, and the best part, I got it for 23$ before taxes which is a great price to pay for this set. The original Canadian asking price is 39.99$ another reason for passing up Jedi Starfighters is their price-per-piece ratio isn't the best. Honestly for 3 Mini-Figures and a Starfighter paying 29.99$ like the A-wing is a much better asking price.</p>
<p>Anyway enough of all this let's move on to the review.</p>
<h4>Box/Instructions</h4>
<p>The box is your typical 2012 Star Wars box, the design works, I always liked it. As the years have progressed I've found that LEGO Star Wars boxes quality goes up, I especially appreciate the uniform look of each years box design. It helps to know which year they were released in and it also helps keep track of the multiple years' worth of sets on the shelf. They've also gotten better at showing off the sets and Mini-Figures a bit more dynamically with a lot more action compared to the older style boxes.</p>
<p>This set actually includes two instruction manuals, for a set of this size I was surprised to find that. I was also very annoyed that there were no protective cardboard bits for these manuals because these manuals... UGH, this set's box has a lot of empty space and the instruction manuals are pretty much the size of instruction manuals you'd find in Battle Pack sets, only a little thicker of course. This means that one of them was completely crumpled into a very unflattering looking mess. If you're going to have such a big box with empty space for a set like this a small cardboard piece and bag to protect the manuals and sticker sheet isn't asking for too much, is it LEGO?</p>
<p>I don't quite understand why the manual is seperated into two booklets actually, I mean for a set with only 4 numbered bags it seems like a bit of a silly thing to do, especially since bag 2 starts in Manual 1 and finishes in Manual 2. A single manual for this set would be far better in my books. At least this manual has all of the cross-promotional stuff included even a Mini-Figure checklist in the back, something the much larger Jabba's Palace was missing.</p>
<h4>Parts</h4>
<p>Lot's of rich green coloured pieces in this set, another one of those fun cockpit domes is included and you get some of those 4294289 parts that I'm not too sure of the name, but find them to be very useful. The set uses mostly stickers for details unfortuantely, however there is a printed piece with cockpit scanner and controls.</p>
<h4>Minifigures</h4>
<p>This set features 3 Mini-Figures, two actual Mini-Figures and an Astromech, two of them are brand new in this set.</p>
<p>Saesee Tiin: This is the Clone Wars version of Saesee Tiin and he's a fantastic looking Mini-Fig. This is my first time owning some unique Jedi, so it's nice to finally get one. I love the soft rubber head piece used to make his Montrails(?) and all the printed detail he's got. The torso is nice with double-sided Jedi robe printing, he's got white arms instead of brown which I assume is meant to represent when he's dressed partially in Clone Armor. A really great looking Mini-Fig.</p>
<p>Even Piell: Brand new for this set is Even Piell, also in his Clone Wars form. Meaning his facial print is more animated and cartoon like, I dig the look of this Mini-Figure as well. He also has a rubber head piece for his wide/large ears and some great scar effects which match the missing eye on his facial print. He also has a double-sided torso print and both Jedi have green lightsabers. It's hard to find anything bad to say about either of these Mini-Figs.</p>
<p>R3-D5: This is your typical R2 shaped Astromech Droid, it's print and colours are brand new for this set as R3 here is Saesee's personal Astromech, there's really not much to say about Astromechs. The printing on them has gotten much better as the years progressed, basically though these Mini-Figs don't offer much to critique. In fact many of them are more like accessories for the ships honestly, still I dig them and you can never have too many Astromechs, they're always fun to collect and army build.</p>
<h4>The build</h4>
<p>Building this set is pretty straight forward. I think if you've built any before you'd probably find it rather repetitive, each step and each bag builds a certain section of the ship, the cockpit is bag 1, the central nosecone and body is bag 2, the left wing is bag 3 and bag 4 is of course the right wing. (Or what you'd call a wing on other types of Starfighters.)</p>
<p>Honestly I found it rewarding and pretty fast to build this ship, there weren't any tricky parts and the manuals were quite clear on how to build it. If you've built more than one and they all share similar build steps you'd probably just breeze through this and find it all rather dull.</p>
<h4>The completed model</h4>
<p>The Jedi Starfighter isn't as iconic as an X-wing or as off-the wall as the Mandalorian Starfighter design, it's still a great looking ship. I love this design in LEGO form it's easy to play with it doesn't just fall apart and even the flick-fire missiles aren't a pain. I love the colours of this version also, the rich dark greens contrast so nicely with the white and the small amount of gold pieces used.</p>
<p>The stickers could have been printed detail and I think they slightly hinder the design, only slightly though. On a scale of 1-5 I'd say .5 is how much they take away from the look because you can obviously tell they're stickers and look just out of place.</p>
<p>Besides the flick-fire missiles the other play feature of this set is that you can use the cockpit as an escape pod. It detaches from two Technic pins that hold it in place and you have an instant escape pod for the Jedi Master.</p>
<h4>Summary</h4>
<p>Overall this is a great set to pick up, on sale, for full price I'd have a few more reservations. Considering the Starfighter only seats one there's no place for Even Piell to fit so that's a knock against it, however just getting two Mini-Figures in this set would have been a really bad decision on LEGO's part.</p>
<p>Since it's retiring soon I definitely think you should pick this one up if you haven't done so yet, while it is more of a Clone Wars set so the Mini-Figures might not be up to everyone's tastes if they don't like the more cartoony nature of them, the set itself has a really nice design and the colours of this particular Jedi Starfighter really pop. Recommended.</p>",TRUE,4,3,4,3,4
